,EAP PROC CODE,Description,CPT,REV CODE,Price,Hospital,Year
0,302706,HCHG ANESTHESIA PROCEDURE EYE,00140,370,594.05,Barton Memorial Hospital,2019
1,302703,HCHG ANESTHESIA PROCEDURE MOUTH,00170,370,772.27,Barton Memorial Hospital,2019
2,343107,HCHG ANESTHESIA FACE SKULL BONE SURGERY,00190,370,619.85,Barton Memorial Hospital,2019
3,308806,HCHG ANESTH CORRECT HEART RHYTHM,00410,370,978.73,Barton Memorial Hospital,2019
4,343278,HCHG BMH ANESTH CARDIAC ELECTROPHYS,00537,379,742.4,Barton Memorial Hospital,2019
5,302712,HCHG ANESTHESIA CHEST SURGERY,00540,370,786.05,Barton Memorial Hospital,2019
6,302737,HCHG ANESTH UPPER ABDOMINAL WALL SURG,00700,370,786.05,Barton Memorial Hospital,2019
7,110355,HCHG ANESTH ABDOMINAL WALL SURG,00800,370,1086.27,Barton Memorial Hospital,2019
8,343279,HCHG BMH ANESTHESIA HIP JOINT PROCEDURE,01200,370,957.63,Barton Memorial Hospital,2019
9,302704,HCHG ANESTHESIA PROCEDURE LOWER LEG,01462,370,772.27,Barton Memorial Hospital,2019
10,343280,"HCHG BMH ANESTHESIA, CLOSED SHOULDER PROCEDURE",01620,379,749.71,Barton Memorial Hospital,2019
11,302794,HCHG ANESTH UPPR ARM PROCEDURE,01730,370,279.28,Barton Memorial Hospital,2019
12,110358,HCHG ANESTH LOWER ARM PROCEDURE,01820,370,749.71,Barton Memorial Hospital,2019
13,4410573,HCHG FNA BIOPSY WO IMAGING EA ADD LESION,10004,761,1126.87,Barton Memorial Hospital,2019
14,4410574,HCHG FNA BIOPSY W US GUIDE 1ST LESION,10005,761,2253.74,Barton Memorial Hospital,2019
15,4410575,HCHG FNA BIOPSY W US GUIDE EA ADD LESION,10006,761,1126.87,Barton Memorial Hospital,2019
16,4410576,HCHG FNA BIOPSY W FLUORO 1ST LESION,10007,761,2253.74,Barton Memorial Hospital,2019
17,4410577,HCHG FNA BIOPSY W FLUORO EA ADD LESION,10008,761,1126.87,Barton Memorial Hospital,2019
18,4410578,HCHG FNA BIOPSY W CT GUIDE 1ST LESION,10009,761,2253.74,Barton Memorial Hospital,2019
19,4410579,HCHG FNA BIOPSY W CT GUIDE EA ADD LESION,10010,761,1126.87,Barton Memorial Hospital,2019
20,4410580,HCHG FNA BIOPSY W MRI 1ST LESION,10011,761,2253.74,Barton Memorial Hospital,2019
21,4410581,HCHG FNA BIOPSY W MRI EA ADD LESION,10012,761,1126.87,Barton Memorial Hospital,2019
22,310036,HCHG FNA WITHOUT IMAGING GUIDANCE,10021,360,1075.23,Barton Memorial Hospital,2019
23,4401607,HCHG IMAGE-GUIDED CATH FLUID DRAINAGE,10030,361,780.4,Barton Memorial Hospital,2019
24,303978,"HCHG I&D ABSCESS, SIMPLE OR SINGLE",10060,510,996.19,Barton Memorial Hospital,2019
25,303979,"HCHG I&D ABSCESS,COMPLICATED/MULT.",10061,510,996.19,Barton Memorial Hospital,2019
26,308281,HCHG BMH/CVMC INCISION DRAINAGE OF PILONIDAL CYST; SIMPLE,10080,450,996.19,Barton Memorial Hospital,2019
27,308283,HCHG BMH/CVMC DRAINAGE OF PILONIDAL CYST; COMPLICATED,10081,450,5041.6,Barton Memorial Hospital,2019
28,304031,HCHG INCISION/REM FB SUBQ SIMPLE,10120,510,1923.28,Barton Memorial Hospital,2019
29,304030,HCHG INCISION/REM FB SUBQ CPLX,10121,510,10271.65,Barton Memorial Hospital,2019
30,308288,HCHG BMH/CVMC DRAINAGE OF HEMATOMA/FLUID,10140,450,4953.51,Barton Memorial Hospital,2019
31,306825,HCHG ASPIRATION PUNCTURE,10160,450,996.19,Barton Memorial Hospital,2019
32,4400566,HCHG PUNCTURE DRAINAGE OF LESION,10160,761,996.19,Barton Memorial Hospital,2019
33,308293,HCHG BMH/CVMC DEBRIDE INFECTED SKIN,11000,510,2289.24,Barton Memorial Hospital,2019
34,308298,HCHG DEBRIDE REMOVAL FOREIGN MATERIAL FX,11010,450,3458.56,Barton Memorial Hospital,2019
35,308302,HCHG DEBRIDE SKIN TISSUE MUSCLE BONE FX,11012,450,6033.92,Barton Memorial Hospital,2019
36,307088,HCHG DEBRIDE SUBQ TISSUE 20SQCM<,11042,761,1751.34,Barton Memorial Hospital,2019
37,308307,HCHG BMH/CVMC DEBRIDE BONE/TISS 1ST 20 SQCM,11044,510,2946.47,Barton Memorial Hospital,2019
38,503431,HCHG INCISIONAL BX OF SKIN SINGLE LESION,11106,761,1059.41,Barton Memorial Hospital,2019
39,503432,HCHG INCISIONAL BX OF SKIN EACH ADD LESION,11107,761,741.59,Barton Memorial Hospital,2019
40,308312,HCHG REMOVAL SKIN TAGS UP TO 15 LESIONS,11200,510,603.26,Barton Memorial Hospital,2019
41,343108,HCHG BMH EXC TR-EXT B9+MARG 0.5<CM,11400,450,2577.37,Barton Memorial Hospital,2019
42,303710,"HCHG EXCISION,BGN LESN SNE <.5 CM",11420,510,3458.44,Barton Memorial Hospital,2019
43,306645,"HCHG DEBRIDE NAIL,ANY METHOD 1 TO 5",11720,761,620.94,Barton Memorial Hospital,2019
44,306646,"HCHG DEBRIDE NAIL,ANY METHOD 6/MORE",11721,761,644.31,Barton Memorial Hospital,2019
45,302850,HCHG AVULSION NAIL PLATE SINGLE,11730,450,583.5,Barton Memorial Hospital,2019
46,308401,HCHG AVULSION OF NAIL PLATE ADD-ON,11732,510,759.68,Barton Memorial Hospital,2019
47,308403,HCHG BMH/CVMC DRAIN BLOOD FROM UNDER NAIL,11740,450,295.59,Barton Memorial Hospital,2019
48,303738,HCHG EXCISION-NAIL & MATRIX,11750,510,2893.25,Barton Memorial Hospital,2019
49,308407,HCHG BMH/CVMC REPAIR OF NAIL BED,11760,450,2224.09,Barton Memorial Hospital,2019
50,308409,HCHG WEDGE EXCISION SKIN NAIL FOLD,11765,450,674.84,Barton Memorial Hospital,2019
51,302738,HCHG REMOVE PILONIDAL CYST SIMPLE,11770,450,6033.92,Barton Memorial Hospital,2019
52,302708,HCHG REMOVE DRUG IMPLANT DEVICE,11982,450,551.28,Barton Memorial Hospital,2019
53,305004,HCHG REPAIR-SMP-SNAGTE <2.5 CM,12001,510,925.18,Barton Memorial Hospital,2019
54,305005,HCHG REPAIR-SMP-SNAGTE 2.6-7.5 CM,12002,510,925.18,Barton Memorial Hospital,2019
55,308414,HCHG BMH/CVMC REPAIR WOUND 7.6-12.5CM SIMPLE,12004,450,925.18,Barton Memorial Hospital,2019
56,308416,HCHG BMH/CVMC REPAIR WOUND 12.6-20.0 SIMPLE,12005,450,925.18,Barton Memorial Hospital,2019
57,308418,HCHG BMH/CVMC REPAIR SUPERFICIAL WOUND 20.1-30.0CM SCALP NECK AXILLAE,12006,450,1607.07,Barton Memorial Hospital,2019
58,308419,HCHG BMH/CVMC REPAIR SUPERFICIAL WOUND >30.0CM SCALP NECK AXILLAE,12007,450,1607.07,Barton Memorial Hospital,2019
59,305001,HCHG REPAIR-SMP-FEENL <2.5 CM,12011,510,925.18,Barton Memorial Hospital,2019
60,305002,HCHG REPAIR-SMP-FEENL 2.6-5.0 CM,12013,510,925.18,Barton Memorial Hospital,2019
61,305003,HCHG REPAIR-SMP-FEENL 5.1-7.5 CM,12014,510,925.18,Barton Memorial Hospital,2019
62,308425,HCHG BMH/CVMC REPAIR SUPERFICIAL WOUND 7.6-12.5CM,12015,450,925.18,Barton Memorial Hospital,2019
63,308427,HCHG BMH/CVMC REPAIR SUPERFICIAL WOUND 12.6-20.0CM FACE EAR EYELID LIP,12016,450,925.18,Barton Memorial Hospital,2019
64,308431,HCHG SIMPLE REPAIR SUPERFICIAL WND > 30CM,12018,450,925.18,Barton Memorial Hospital,2019
65,308433,HCHG BMH/CVMC CLOSURE OF SPLIT WOUND SIMPLE,12020,450,1754.38,Barton Memorial Hospital,2019
66,305733,HCHG WOUND CARE W/ PACKING,12021,510,1258.08,Barton Memorial Hospital,2019
67,304997,HCHG REPAIR-INT-SATE <2.5 CM,12031,510,925.18,Barton Memorial Hospital,2019
68,304998,HCHG REPAIR-INT-SATE 2.6-7.5 CM,12032,510,2224.09,Barton Memorial Hospital,2019
69,343150,"HCHG BMH REPAIR, INTERMEDIATE, WOUNDS 2.6CM TO 7.5CM",12032,760,2224.09,Barton Memorial Hospital,2019
70,308437,HCHG BMH/CVMC LAYER OF CLOSURE WOUND 7.6-12.5CM,12034,450,925.18,Barton Memorial Hospital,2019
71,308439,HCHG BMH/CVMC LAYER CLOSE WOUND 12.6-20.0CM,12035,450,925.18,Barton Memorial Hospital,2019
72,308441,"HCHG BMH/CVMC REPAIR, INTMD, WOUNDS 20.1-30.0 CM",12036,450,2099.2,Barton Memorial Hospital,2019
73,308445,HCHG BMH/CVMC LAYER CLOSURE OF WOUND 2.5CM OR <,12041,450,925.18,Barton Memorial Hospital,2019
74,308447,HCHG BMH/CVMC LAYER CLOSURE WOUND 2.6-7.5CM,12042,450,925.18,Barton Memorial Hospital,2019
75,343109,HCHG BMH LAYER CLOSE WOUND 7.6-12.5CM NECK HAND FEE GENITALIA,12044,450,925.18,Barton Memorial Hospital,2019
76,308457,HCHG BMH/CVMC LAYER CLOSURE OF WOUND 2.5CM OR <,12051,450,925.18,Barton Memorial Hospital,2019
77,308459,HCHG BMH/CVMC LAYER OF CLOSURE WOUND 2.6-5.0CM,12052,450,925.18,Barton Memorial Hospital,2019
78,308461,HCHG BMH/CVMC LAYER CLOSURE OF WOUND 5.1-7.5CM,12053,450,925.18,Barton Memorial Hospital,2019
79,308463,HCHG BMH/CVMC LAYER CLOSSURE WOUND 7.6-12.5CM,12054,450,925.18,Barton Memorial Hospital,2019
80,308465,HCHG BMH/CVMC LAYER CLOSE WOUND 12.6-20.0CM FACE EARS EJYELID NOSE LIP,12055,450,1258.08,Barton Memorial Hospital,2019
81,308473,HCHG BMH/CVMC REPAIR WOUND/LESION 2.6-7.5CM COMPLEX TRUNK,13101,450,2301.16,Barton Memorial Hospital,2019
82,308475,HCHG BMH/CVMC REPAIR WOUND/LESION ADD-ON 5 CM OR LESS,13102,450,806.19,Barton Memorial Hospital,2019
83,308477,HCHG BMH/CVMC REPAIR WOUND/LESION 1.1-2.5CM COMPLEX SCALP ARM LEG,13120,450,1258.08,Barton Memorial Hospital,2019
84,308479,HCHG BMH/CVMC REPAIR WOUND/LESION 2.6-7.5CM COMPLEX SCALP ARM LEG,13121,450,2224.09,Barton Memorial Hospital,2019
85,308481,"HCHG BMH/CVMC REPAIR WOUND/LESION ADD-ON 5CM OR< COMPLEX SCALP,ARM,LEG",13122,450,1020.22,Barton Memorial Hospital,2019
86,308483,"HCHG BMH/CVMC REPAIR WOUND/LESION1.1-2.5CM COMPLEX FOREHEAD,CHEEK,CHIN",13131,450,2224.09,Barton Memorial Hospital,2019
87,308485,HCHG BMH/CVMC REPAIR WOUND/LESION 2.6-7.5CM,13132,450,2357.53,Barton Memorial Hospital,2019
88,308487,HCHG BMH/CVMC REPAIR COMPLEX FOREHEAD CHEEK CHIN MOUTH NECK ADD<5CM,13133,450,2224.09,Barton Memorial Hospital,2019
89,308491,"HCHG BMH/CVMC REPAIR WOUND/LESION1.1-2.5CM COMPLEX EYELID,NOSE,EAR,LIP",13151,450,1258.08,Barton Memorial Hospital,2019
90,308493,HCHG REPAIR COMPLEX WOUND 2.6-7.5CM,13152,450,2301.16,Barton Memorial Hospital,2019
91,308495,HCHG REPAIR COMPLEX WOUND EA ADDL 5CM <,13153,450,623.16,Barton Memorial Hospital,2019
92,305586,HCHG TX BURN 1ST DEGREE INITIAL,16000,510,583.5,Barton Memorial Hospital,2019
93,303483,HCHG DRESS/DEBRIDE-SMALL,16020,510,1069.14,Barton Memorial Hospital,2019
94,303482,HCHG DRESS/DEBRIDE-MEDIUM,16025,510,1069.14,Barton Memorial Hospital,2019
95,303481,HCHG DRESS/DEBRIDE-LARGE,16030,510,1069.14,Barton Memorial Hospital,2019
96,303357,HCHG DEST FLAT WARTS <15 LESIONS,17110,510,1427.7,Barton Memorial Hospital,2019
97,5400000,HCHG CHEMICAL CAUTERIZATION TISSUE,17250,750,465.63,Barton Memorial Hospital,2019
98,5400001,HCHG BMH 2 OR 3 CHEMICAL CAUTERY TISSUE,17250,750,465.63,Barton Memorial Hospital,2019
99,308508,HCHG SKIN TISSUE PROCEDURE,17999,450,3102.9,Barton Memorial Hospital,2019
100,309584,HCHG BMH/CVMC DRAINAGE OF BREAST LESION,19000,450,2891.49,Barton Memorial Hospital,2019
101,4400565,HCHG PUNC/ASPIR BREAST CYST,19000,761,2891.49,Barton Memorial Hospital,2019
102,4400564,"HCHG PUCT/ASPIR BREAST CYST,EACH A*",19001,761,635.49,Barton Memorial Hospital,2019
103,308511,"HCHG BMH/CVMC MASTOTOMY WITH EXPLORATION OR DRAINAGE OF ABSCESS, DEEP",19020,450,12527.44,Barton Memorial Hospital,2019
104,4410525,HCHG BX BREAST 1ST LESION STRTCTC,19081,401,4390.87,Barton Memorial Hospital,2019
105,4410526,HCHG BX BREAST ADD LESION STRTCTC,19082,401,2503.16,Barton Memorial Hospital,2019
106,4410527,HCHG BX BREAST 1ST LESION US IMAG,19083,402,4390.87,Barton Memorial Hospital,2019
107,4410528,HCHG BX BREAST ADD LESION US IMAG,19084,402,2503.16,Barton Memorial Hospital,2019
108,4410531,HCHG PERQ DEVICE BREAST 1ST IMAG,19281,402,2101.44,Barton Memorial Hospital,2019
109,4410532,HCHG PERQ DEVICE BREAST EA IMAG,19282,402,1050.72,Barton Memorial Hospital,2019
110,4410533,HCHG PERQ DEV BREAST 1ST STRTCTC,19283,402,2135.75,Barton Memorial Hospital,2019
111,4410535,HCHG PERQ DEV BREAST 1ST US IMAG,19285,402,2101.44,Barton Memorial Hospital,2019
112,4410536,HCHG PERQ DEV BREAST ADD US IMAG,19286,402,1050.72,Barton Memorial Hospital,2019
113,343110,HCHG BMH EXPLORE WOUND ABDOMEN,20102,450,6414.4,Barton Memorial Hospital,2019
114,308520,HCHG BMH/CVMC EXPLORE OF PENETRATIN WOUND EXTREMITY,20103,450,2291.74,Barton Memorial Hospital,2019
115,4400495,"HCHG NEEDLE BIOPSY,MUSCLE",20206,761,2062.03,Barton Memorial Hospital,2019
116,4400186,"HCHG BONE BIOPSY,TROCAR/NEEDLE SUPERF",20220,761,1983.22,Barton Memorial Hospital,2019
117,4400185,"HCHG BONE BIOPSY,TROCAR/NEEDLE DEEP",20225,761,6014.51,Barton Memorial Hospital,2019
118,308522,HCHG BMH/CVMC REMOVAL OF FOREIGN BODY SIMPLE,20520,450,3659.71,Barton Memorial Hospital,2019
119,308524,HCHG REMOVAL FB DEEP COMPLICATED,20525,450,6772.17,Barton Memorial Hospital,2019
120,306584,HCHG INJ(S)-TRIGGER PT(S)-1/2MUSCU*,20552,450,1704.24,Barton Memorial Hospital,2019
121,304099,HCHG INJ(S)-TRIGGER PT(S)-3/MORE MS,20553,761,842.9,Barton Memorial Hospital,2019
122,304103,HCHG INJ/ASPIR-SMALL JT/BURSA W/O US GUIDE,20600,510,1928.36,Barton Memorial Hospital,2019
123,4400291,HCHG INJ/ASPIR-SMALL JT/BURSA W/O US GUIDE,20600,761,1928.36,Barton Memorial Hospital,2019
124,304104,HCHG INJ/ASPIR-INTERMED JT/BURSA W/O US GUIDE,20605,761,1657.05,Barton Memorial Hospital,2019
125,4400289,HCHG INJ/ASPIR-INTERMED JT/BURSA W/O US GUIDE,20605,761,1657.05,Barton Memorial Hospital,2019
126,304668,HCHG INJ/ASPIR-INTERMED JT/BURSA WITH US GUIDE,20606,761,2137.82,Barton Memorial Hospital,2019
127,343111,HCHG BMH DRAIN/INJECT JOINT/BURSA,20610,450,2143.16,Barton Memorial Hospital,2019
128,343151,HCHG BMH ASPIRATION AND/OR INJECTION; MAJOR JOINT OR BURSA,20610,760,2143.16,Barton Memorial Hospital,2019
129,4400290,HCHG INJ/ASPIR-LARGE JT/BURSA W/O US GUIDE,20610,761,2143.16,Barton Memorial Hospital,2019
130,304690,HCHG INJ/ASPIR-LARGE JT/BURSA WITH US GUIDE,20611,450,954.64,Barton Memorial Hospital,2019
131,308532,HCHG BMH REMOVAL OF SUPPORT IMPLANT,20670,450,8649.8,Barton Memorial Hospital,2019
132,110367,HCHG INTERDENTAL FIXATION,21110,450,4477.91,Barton Memorial Hospital,2019
133,308537,HCHG BMH/CVMC TREATMENT OF NASAL BONE FRACTURE W/O MANIPULATION,21310,450,1236.41,Barton Memorial Hospital,2019
134,308539,HCHG BMH/CVMC CLOSED TX OF NASAL BONE FRACTURE W/O STABILIZATION,21315,450,4229.88,Barton Memorial Hospital,2019
135,308542,HCHG BMH/CVMC TREAT DENTAL RIDGE FRACTURE,21440,450,17434.28,Barton Memorial Hospital,2019
136,308543,HCHG BMH TREAT LOWER JAW FRACTURE W/O MANIPULATION,21450,450,1197.48,Barton Memorial Hospital,2019
137,308545,HCHG RESET DISLOCATED JAW CLOSED TX INITIAL OR SUBSEQUENT,21480,450,1197.48,Barton Memorial Hospital,2019
138,308547,HCHG BMH/CVMC DRAIN NECK/CHEST LESION,21501,450,10017.37,Barton Memorial Hospital,2019
139,4400183,HCHG BIOPSY SOFT TISSUE NECK/CHEST,21550,761,4248.65,Barton Memorial Hospital,2019
140,308550,HCHG BMH CLOSED TREATMENT STERNUM FRACTURE,21820,450,1051.78,Barton Memorial Hospital,2019
141,4401603,"HCHG BMH BIOPSY, SOFT TISSUE OF BACK OR FLANK; SUPERFICIAL",21920,360,4142.4,Barton Memorial Hospital,2019
142,308551,"HCHG BMH BIOPSY, SOFT TISSUE OF BACK OR FLANK; DEEP",21925,360,7225.85,Barton Memorial Hospital,2019
143,343201,HCHG BMH CLOSED TX VERT FX W/O MANI,22310,450,2683.36,Barton Memorial Hospital,2019
144,342760,HCHG PERQ CERIVICOTHORACIC INJECT,22510,761,10993.04,Barton Memorial Hospital,2019
145,372761,HCHG PERQ LUMBOSACRAL INJECTION,22511,761,10993.04,Barton Memorial Hospital,2019
146,342762,HCHG VERTEBROPLASTY ADDL INJECT,22512,761,10993.04,Barton Memorial Hospital,2019
147,342763,HCHG PERQ VERTEBRAL AUGMENT THORACIC,22513,761,30099.77,Barton Memorial Hospital,2019
148,342764,HCHG PERQ VERTEBRAL AUGMENT LUMBAR,22514,761,29223.23,Barton Memorial Hospital,2019
149,342765,HCHG PERQ VERTEBRAL AUG EACH ADDL,22515,761,29223.23,Barton Memorial Hospital,2019
150,4400350,HCHG INJ PROC SHOULDER ARTHROGRAPHY/CT/MRI,23350,761,941.6,Barton Memorial Hospital,2019
151,308553,HCHG BMH/CVMC TREAT CLAVICLE FX W/O MANIPULATION,23500,450,1126.71,Barton Memorial Hospital,2019
152,308555,HCHG BMH/CVMC TREAT CLAVICLE FRACTURE CLOSED,23505,450,1260.03,Barton Memorial Hospital,2019
153,303451,HCHG DISLOC STERNOCLAVICULAR CLSD,23520,450,1103.9,Barton Memorial Hospital,2019
154,303449,HCHG DISLOC ACROMIOCLAVICULAR CLSD,23540,450,1126.71,Barton Memorial Hospital,2019
155,308561,HCHG BMH/CVMC TREAT CLAVICLE DISLOCATION CLOSED W/MANIPULATION,23545,450,1491.31,Barton Memorial Hospital,2019
156,308563,HCHG BMH/CVMC TREAT SHOULDER BLADE FX W/O MANI,23570,450,1165.09,Barton Memorial Hospital,2019
157,308565,HCHG BMH/CVMC TREAT SHOULDER BLADE FX,23575,450,1284.1,Barton Memorial Hospital,2019
158,308567,HCHG BMH/CVMC TREAT HUMERUS FX W/O MANIPULATION,23600,450,1145.7,Barton Memorial Hospital,2019
159,308568,HCHG TREAT HUMERUS FRACTURE CLOSED,23605,450,7343.06,Barton Memorial Hospital,2019
160,308570,HCHG BMH/CVMC TREAT HUMERUS FRACTURE W/O MAN,23620,450,1145.7,Barton Memorial Hospital,2019
161,308571,HCHG BMH CLOSED TX OF GREATER HUMERAL TUBEROSITY FRACTURE W/MANI,23625,450,6334.16,Barton Memorial Hospital,2019
162,303450,HCHG DISLOC SHOULDER W/MANIP CLSD,23650,450,1126.71,Barton Memorial Hospital,2019
163,308574,HCHG BMH/CVMC TREAT SHOULDER DISLOCATION,23655,450,6767.12,Barton Memorial Hospital,2019
164,308576,HCHG BMH/CVMC TREAT DISLOCATION/FRACTURE W/MANIPULATION,23665,450,3972.71,Barton Memorial Hospital,2019
165,308531,HCHG BMH REMOVAL OF FOREIGN BODY ARM,24201,450,5177.48,Barton Memorial Hospital,2019
166,4400371,HCHG INJECTION FOR ELBOW ARTHROGRAM,24220,761,303.85,Barton Memorial Hospital,2019
167,308582,HCHG BMH/CVMC CLOSED TX OF HUMERAL SHAFT FRACTURE; W/O MANIPULATION,24500,450,1146.47,Barton Memorial Hospital,2019
168,308584,HCHG BMH/CVMC TREAT HUMERUS FRACTURE W/WO SKELETAL TRACTION,24505,450,1126.71,Barton Memorial Hospital,2019
169,308586,HCHG BMH/CVMC CLOSED TX HUMERUS FX W/O MANIPULATION,24530,450,1146.47,Barton Memorial Hospital,2019
170,308588,HCHG BMH/CVMC TREAT HUMERUS FRACTURE CLOSED W/MANIPULATION,24535,450,1111.57,Barton Memorial Hospital,2019
171,308590,HCHG BMH/CVMC TX HUMERUS FX-W MANIPULATION,24565,450,1111.57,Barton Memorial Hospital,2019
172,343112,"HCHG BMH CLOSED TREATMENT OF HUMERAL CONDYLAR FRACTURE, W/O MANI",24576,450,838.21,Barton Memorial Hospital,2019
173,308592,HCHG BMH/CVMC TREAT HUMERUS FRACTURE CLOSED  MEDIAL/LATERAL W/MAN,24577,450,1111.57,Barton Memorial Hospital,2019
174,303454,HCHG DISLOC TX ELBOW W/O ANES CLSD,24600,450,1126.71,Barton Memorial Hospital,2019
175,308595,HCHG TREAT ELBOW DISLOCATION W/ANE,24605,450,6767.12,Barton Memorial Hospital,2019
176,308597,HCHG BMH/CVMC CLOSED TX OF MONTEGGIA TYPE OF FX  DISLOCATION AT ELBOW,24620,450,13996.56,Barton Memorial Hospital,2019
177,305587,HCHG TX ELBOW CHILD W/MANIP CLSD,24640,450,1126.71,Barton Memorial Hospital,2019
178,308600,HCHG BMH/CVMC CLOSED TX RADIUS FX W/O MANIPULATION,24650,450,1126.71,Barton Memorial Hospital,2019
179,308602,HCHG BMH/CVMC TREAT RADIUS FX W/MANIPULATION,24655,450,1658.35,Barton Memorial Hospital,2019
180,308604,HCHG BMH/CVMC CLOSED TX ULNAR FX WO MANIPULATION,24670,450,1419.57,Barton Memorial Hospital,2019
181,4400375,HCHG INJECTION FOR WRIST ARTHROGRAM,25246,761,1398.4,Barton Memorial Hospital,2019
182,308607,HCHG REPAIR FOREARM TENDON MUSCLE LVL I,25260,450,9238.11,Barton Memorial Hospital,2019
183,302713,HCHG REPAIR FOREARM TENDON MUSCLE LVL II,25270,450,8176.46,Barton Memorial Hospital,2019
184,308609,HCHG BMH/CVMC TX FRACTURE OF RADIUS W/O MANIPULATION,25500,450,1111.57,Barton Memorial Hospital,2019
185,308611,HCHG BMH/CVMC CLOSED TX OF RADIAL SHAFT W/MANIPULATION,25505,450,3972.71,Barton Memorial Hospital,2019
186,308612,HCHG BMH CLOSED TREATMENT OF RADIAL SHAFT FRACTURE,25520,450,659.94,Barton Memorial Hospital,2019
187,308614,HCHG BMH/CVMC TX FX OF ULNA W/O MANIPULATION,25530,450,1111.57,Barton Memorial Hospital,2019
188,308616,HCHG BMH/CVMC TREAT FRACTURE OF ULNA WITH MANIPULATION,25535,450,1111.57,Barton Memorial Hospital,2019
189,308618,HCHG BMH/CVMC TREAT FX RADIUS/ULNA W/O MANIPULATION,25560,450,1145.7,Barton Memorial Hospital,2019
190,308620,HCHG BMH/CVMC TREAT FX RADIUS/ULNA W/MANIPULATION,25565,450,3972.71,Barton Memorial Hospital,2019
191,308622,HCHG BMH/CVMC TREAT FX W/O MANIPULATION,25600,450,1145.7,Barton Memorial Hospital,2019
192,307105,HCHG DISLOC TX RADIUS/ULNA CLSD,25605,450,3972.71,Barton Memorial Hospital,2019
193,308625,HCHG BMH/CVMC CLOSED TX WRIST BONE FX WO MANIPULATION,25622,450,1146.47,Barton Memorial Hospital,2019
194,308627,HCHG BMH/CVMC CLOSED TX OF CARPAL SCAPHOID FRACTURE W/MANIPULATION,25624,450,4330.25,Barton Memorial Hospital,2019
195,308629,HCHG BMH/CVMC CLOSED TX WRIST BONE FX WO MANIPULATION,25630,450,1146.47,Barton Memorial Hospital,2019
196,308631,HCHG BMH/CVMC TX OF CARPAL BONE FX W/MANIPULATION,25635,450,1910.18,Barton Memorial Hospital,2019
197,308633,HCHG BMH/CVMC TREAT WRIST BONE FRACTURE CLOSED/ULNAR STYLOID,25650,450,1111.57,Barton Memorial Hospital,2019
198,303453,HCHG DISLOC TX CARPAL W/MANIP CLSD,25660,450,1111.57,Barton Memorial Hospital,2019
199,308635,HCHG BMH/CVMC TREAT WRIST DISLOCATION CLOSED W/MANIPULATION,25675,450,1111.57,Barton Memorial Hospital,2019
200,308636,HCHG BMH TREAT WRIST FRACTURE,25680,450,1111.57,Barton Memorial Hospital,2019
201,308640,HCHG BMH/CVMC DRAINAGE OF FINGER ABSCESS,26010,450,996.19,Barton Memorial Hospital,2019
202,308642,HCHG DRAINAGE FINGER ABSCESS COMPLICATED,26011,360,4018.86,Barton Memorial Hospital,2019
203,308644,HCHG INCISE FINGER TENDON SHEATH,26055,450,5311.05,Barton Memorial Hospital,2019
204,362121,HCHG PARTIAL REMOVAL OF FINGER BONE,26236,450,6305.72,Barton Memorial Hospital,2019
205,302711,HCHG REPAIR FINGER HAND TENDON,26370,450,10220.57,Barton Memorial Hospital,2019
206,308645,HCHG BMH REPAIR FINGER TENDON W/O GRAFT,26418,450,10733.03,Barton Memorial Hospital,2019
207,110365,HCHG TENDON LENGTHENING,26476,450,5311.05,Barton Memorial Hospital,2019
208,308647,HCHG BMH/CVMC TREAT METACARPAL FX W/O MANIPULATION,26600,450,1145.7,Barton Memorial Hospital,2019
209,308649,HCHG TREAT METACARPAL FX W MANIPULATION,26605,450,1126.71,Barton Memorial Hospital,2019
210,308651,HCHG BMH/CVMC TREAT METACARPAL FRACTURE W/MANIPULATION EACH BONE,26607,450,1111.57,Barton Memorial Hospital,2019
211,308653,HCHG BMH/CVMC TEAT THUMB DISLOCATION W/MANIPULATION,26641,450,1145.7,Barton Memorial Hospital,2019
212,308655,HCHG BMH/CVMC TREAT THUMB FRACTURE CLOSED W/MANIPULATION,26645,450,1111.57,Barton Memorial Hospital,2019
213,308657,HCHG BMH/CVMC TX HAND DISLOCATION W/MANIPULATION W/O ANES,26670,450,1111.57,Barton Memorial Hospital,2019
214,308659,HCHG BMH/CVMC TX KNUCKLE DISLOCATION W/MANIPULATION W/O ANES,26700,450,1126.71,Barton Memorial Hospital,2019
215,308661,HCHG BMH/CVMC TREAT FINGER FX EACH W/O MANIPULATION,26720,450,1126.71,Barton Memorial Hospital,2019
216,308663,HCHG TX FINGER FX-W MANIPULATION,26725,450,1126.71,Barton Memorial Hospital,2019
217,308665,HCHG BMH/CVMC TX FINGER FX EACH W/O MANIPULATION,26740,450,1111.57,Barton Memorial Hospital,2019
218,308667,HCHG BMH/CVMC TREAT FINGER FRACTURE EACH CLOSED W/MANIPULATION,26742,450,1126.71,Barton Memorial Hospital,2019
219,308669,HCHG BMH/CVMC CLOSED TX FINGER FX W/O MAN,26750,450,1146.47,Barton Memorial Hospital,2019
220,308671,HCHG BMH/CVMC TREAT FINGER FX EACH W/MANIPULATION,26755,450,1111.57,Barton Memorial Hospital,2019
221,343113,"HCHG BMH OPEN TREATMENT OF DISTAL PHALANGEAL FRACTURE, EACH",26765,450,16440.26,Barton Memorial Hospital,2019
222,307077,HCHG DISLOC TX FINGER W/O ANES CLSD,26770,450,1126.71,Barton Memorial Hospital,2019
223,343114,HCHG CLOSED TX FINGER DISLOCATION,26775,450,4708.79,Barton Memorial Hospital,2019
224,308673,HCHG BMH/CVMC AMPUTATION FINGER THUMB,26951,450,5513.29,Barton Memorial Hospital,2019
225,308674,HCHG BMH AMPUTATION FINGER THUMB 1ST/2ND ANY SINGLE W/LOCAL,26952,450,5745.13,Barton Memorial Hospital,2019
226,343115,HCHG BMH HAND/FINGER PROCEDURE-UNLISTED,26989,450,1826.5,Barton Memorial Hospital,2019
227,4400376,HCHG INJECTION HIP ARTHROGRAM,27093,761,1346.79,Barton Memorial Hospital,2019
228,4400377,HCHG INJECTION HIP ARTHROGRAM ANESTHESIA,27095,761,2376.2,Barton Memorial Hospital,2019
229,343202,HCHG BMH INJECT SACROILIAC JOINT,27096,361,1884.71,Barton Memorial Hospital,2019
230,4400361,HCHG INJECT FOR SACROILIAC JOINT,27096,761,1884.71,Barton Memorial Hospital,2019
231,362119,HCHG TX PELVIC RING FX W/O MANIP,27197,450,1035.07,Barton Memorial Hospital,2019
232,362120,HCHG TX PELVIC RING FX W/ MANIP,27198,450,1035.07,Barton Memorial Hospital,2019
233,308680,"HCHG BMH/CVMC CLOSED TX THIGH FX W/O MAN PROXIMAL END,NECK",27230,450,1146.47,Barton Memorial Hospital,2019
234,308682,HCHG TREAT HIP DISLOCATION W/O ANES,27250,450,1126.71,Barton Memorial Hospital,2019
235,343203,HCHG BMH TREAT HIP DISLOCATION,27252,450,5321.45,Barton Memorial Hospital,2019
236,110364,HCHG TREAT HIP DISLOCATION,27256,450,845.49,Barton Memorial Hospital,2019
237,308684,HCHG TREAT HIP DISLOCATION WO ANES,27265,450,1126.71,Barton Memorial Hospital,2019
238,308686,HCHG BMH/CVMC CLOSED TX POST HIP ARTHROPLASTY DISLOCATION W/ANES,27266,450,5047.94,Barton Memorial Hospital,2019
239,308687,"HCHG BMH I&D,DEEP ABSCESS BURSA OR HEMATOMA,THIGH OR KNEE REGION",27301,450,6503.07,Barton Memorial Hospital,2019
240,308851,HCHG BIOPSY THIGH SOFT TISSUES,27323,360,5874.53,Barton Memorial Hospital,2019
241,503452,HCHG INJ CONTRAST KNEE RAD CT MRI ARTHO,27369,761,439.27,Barton Memorial Hospital,2019
242,308688,HCHG BMH SUTURE OF QUADRICEPS OR HAMSTRING MUSCLE RUPTURE PRIMARY,27385,450,11518.54,Barton Memorial Hospital,2019
243,308690,HCHG BMH/CVMC CLOSED TX OF THIGH FX W/O MAN,27500,450,1146.47,Barton Memorial Hospital,2019
244,308692,HCHG BMH/CVMC CLOSED TX OF THIGH FX W/O MANIPULATION,27501,450,1146.47,Barton Memorial Hospital,2019
245,308694,HCHG BMH/CVMC TREATMENT OF THIGH FRACTURE W/MANIPULATION,27503,450,1111.57,Barton Memorial Hospital,2019
246,308696,HCHG BMH/CVMC CLOSED TX OF THIGH FX W/O MANIPULATION MEDIAL OR LATERAL,27508,450,1146.47,Barton Memorial Hospital,2019
247,308697,HCHG BMH TX OF THIGH FX-W MANIPULATION,27510,450,1111.57,Barton Memorial Hospital,2019
248,308699,HCHG BMH/CVMC CLOSED TX KNEE FX W/O MANIPULATION,27530,450,1253.59,Barton Memorial Hospital,2019
249,303455,HCHG DISLOC TX KNEE W/O ANES CLSD,27550,450,1126.71,Barton Memorial Hospital,2019
250,308702,HCHG BMH/CVMC TREAT KNEECAP DISLOCATION W/O ANESTHESIA,27560,450,1126.71,Barton Memorial Hospital,2019
251,4400369,HCHG INJECTION FOR ANKLE ARTHROGRAM,27648,761,912.17,Barton Memorial Hospital,2019
252,308706,HCHG BMH/CVMC TX OF TIBIA FX W/O MANIPULATION,27750,450,1145.7,Barton Memorial Hospital,2019
253,308708,HCHG BMH/CVMC CLOSED TX TIBIAL SHAFT FX W&WO FIBULAR FX W/MANIPULATION,27752,450,7343.06,Barton Memorial Hospital,2019
