,EAP,Description,Revenue Code,Inpatient Price,Outpatient Price,Hospital,Year
2446,42100547,HCHG PROCALCITONIN (PCT),301.0,439.0,439.0,Sutter Medical Center - Sacramento,2019
2447,42100571,HCHG OCCULT BLD IA SCRN,301.0,78.0,78.0,Sutter Medical Center - Sacramento,2019
2448,42100600,HCHG PAMG-IC/V QUAL EACH SPECIMEN,301.0,352.0,352.0,Sutter Medical Center - Sacramento,2019
2449,42100816,HCHG CORTISOL STIMULATING ACTH,301.0,269.0,269.0,Sutter Medical Center - Sacramento,2019
2450,42100824,HCHG RPR NON-TREPNML AB QL,302.0,89.0,75.0,Sutter Medical Center - Sacramento,2019
2451,42100825,HCHG LACTIC ACID BLOOD,301.0,260.0,260.0,Sutter Medical Center - Sacramento,2019
2452,42100831,HCHG SURG PATH LVL III,312.0,202.0,202.0,Sutter Medical Center - Sacramento,2019
2453,42100837,HCHG GTT 3HR 1ST 3 SPEC,301.0,182.0,182.0,Sutter Medical Center - Sacramento,2019
2454,42100853,HCHG OCC BLD 1-3 SPC NO NPLSM,301.0,71.0,71.0,Sutter Medical Center - Sacramento,2019
2455,42100854,HCHG GLUCOSE TOL TEST 1 HR,301.0,82.0,82.0,Sutter Medical Center - Sacramento,2019
2456,42100855,HCHG PATH SURG LVL IV GROSS & MICRO,312.0,264.0,264.0,Sutter Medical Center - Sacramento,2019
2457,42100856,HCHG MICROALBUMIN QUANTITATIVE,301.0,101.0,101.0,Sutter Medical Center - Sacramento,2019
2458,42100857,HCHG ALPHA-FETOPROTEIN SERUM,301.0,149.0,124.0,Sutter Medical Center - Sacramento,2019
2459,42100858,HCHG ASSAY OF AMYLASE,301.0,181.0,144.0,Sutter Medical Center - Sacramento,2019
2460,42100859,HCHG BILIRUBIN TOTAL,301.0,190.0,83.0,Sutter Medical Center - Sacramento,2019
2461,42100860,HCHG ASSAY OF CALCIUM TOTAL,301.0,89.0,74.0,Sutter Medical Center - Sacramento,2019
2462,42100861,HCHG ASSAY OF CALCIUM IN URINE,301.0,92.0,92.0,Sutter Medical Center - Sacramento,2019
2463,42100862,HCHG ASSAY OF URINE CHLORIDE,301.0,121.0,121.0,Sutter Medical Center - Sacramento,2019
2464,42100863,HCHG ASSAY BLD/SERUM CHOLESTEROL,301.0,100.0,86.0,Sutter Medical Center - Sacramento,2019
2465,42100864,HCHG ASSAY OF URINE CREATININE,301.0,104.0,104.0,Sutter Medical Center - Sacramento,2019
2466,42100865,HCHG ASSAY OF GAMMAGLOBULIN IGM,301.0,62.0,62.0,Sutter Medical Center - Sacramento,2019
2467,42100866,HCHG GLUCOSE OTHER FLUID,301.0,139.0,139.0,Sutter Medical Center - Sacramento,2019
2468,42100867,HCHG GLUCOSE TOLERANCE TEST (GTT),301.0,182.0,182.0,Sutter Medical Center - Sacramento,2019
2469,42100868,HCHG ASSAY OF LACTIC ACID,301.0,260.0,260.0,Sutter Medical Center - Sacramento,2019
2470,42100869,HCHG LACTATE (LD) (LDH) ENZYME,301.0,123.0,102.0,Sutter Medical Center - Sacramento,2019
2471,42100870,HCHG ASSAY OF MAGNESIUM,301.0,156.0,119.0,Sutter Medical Center - Sacramento,2019
2472,42100871,HCHG ASSAY OF URINE PHOSPHORUS,301.0,101.0,101.0,Sutter Medical Center - Sacramento,2019
2473,42100872,HCHG ASSAY OF SERUM POTASSIUM,301.0,109.0,75.0,Sutter Medical Center - Sacramento,2019
2474,42100873,HCHG ASSAY OF URINE POTASSIUM,301.0,99.0,99.0,Sutter Medical Center - Sacramento,2019
2475,42100874,HCHG ASSAY OF PROTEIN URINE,301.0,91.0,81.0,Sutter Medical Center - Sacramento,2019
2476,42100875,HCHG ASSAY OF PROTEIN OTHER,301.0,165.0,165.0,Sutter Medical Center - Sacramento,2019
2477,42100876,HCHG ASSAY OF URINE SODIUM,301.0,113.0,113.0,Sutter Medical Center - Sacramento,2019
2478,42100877,HCHG ASSAY OF TRIGLYCERIDES,301.0,121.0,87.0,Sutter Medical Center - Sacramento,2019
2479,42100878,HCHG ASSAY OF URINE/UREA-N,301.0,110.0,110.0,Sutter Medical Center - Sacramento,2019
2480,42100879,HCHG ASSAY OF URINE/URIC ACID,301.0,92.0,92.0,Sutter Medical Center - Sacramento,2019
2481,42100880,HCHG CHORIONIC GONADOTROPIN TEST,301.0,303.0,243.0,Sutter Medical Center - Sacramento,2019
2482,42100881,HCHG CHORIONIC GONADOTROPIN ASSAY,301.0,208.0,208.0,Sutter Medical Center - Sacramento,2019
2483,42100882,HCHG BLOOD SEROLOGY QUALITATIVE,302.0,89.0,75.0,Sutter Medical Center - Sacramento,2019
2484,42100883,HCHG CULTURE BACTERIA OTHER,306.0,220.0,127.0,Sutter Medical Center - Sacramento,2019
2485,43000000,HCHG BLEEDING TIME TEST,305.0,124.0,124.0,Sutter Medical Center - Sacramento,2019
2486,43000001,HCHG PLATELET FUNCTION TEST,305.0,124.0,124.0,Sutter Medical Center - Sacramento,2019
2487,43000002,HCHG AUTO DIFF WBC COUNT,305.0,158.0,158.0,Sutter Medical Center - Sacramento,2019
2488,43000003,HCHG BLOOD SMEAR EXAM W/ MANUAL DIFFERENTIAL,305.0,72.0,72.0,Sutter Medical Center - Sacramento,2019
2489,43000004,HCHG BLOOD SMEAR EXAM W/O MANUAL DIFFERENTIAL,305.0,39.0,39.0,Sutter Medical Center - Sacramento,2019
2490,43000006,HCHG HEMATOCRIT SPUN,305.0,69.0,69.0,Sutter Medical Center - Sacramento,2019
2491,43000007,HCHG HEMATOCRIT,305.0,60.0,60.0,Sutter Medical Center - Sacramento,2019
2492,43000008,HCHG HEMOGLOBIN,305.0,56.0,46.0,Sutter Medical Center - Sacramento,2019
2493,43000009,HCHG CBC AUTOMATED W/ AUTOMATED DIFFERENTIAL,305.0,158.0,122.0,Sutter Medical Center - Sacramento,2019
2494,43000010,HCHG CBC AUTOMATED,305.0,128.0,128.0,Sutter Medical Center - Sacramento,2019
2495,43000011,HCHG MANUAL CELL COUNT EA,305.0,83.0,83.0,Sutter Medical Center - Sacramento,2019
2496,43000013,HCHG RETICULOCYTE MANUAL,305.0,140.0,140.0,Sutter Medical Center - Sacramento,2019
2497,43000014,HCHG RETICULOCYTE AUTOMATED,305.0,87.0,87.0,Sutter Medical Center - Sacramento,2019
2498,43000015,HCHG WBC COUNT AUTOMATED,305.0,40.0,40.0,Sutter Medical Center - Sacramento,2019
2499,43000016,HCHG PLATELET COUNT AUTOMATED,305.0,97.0,97.0,Sutter Medical Center - Sacramento,2019
2500,43000018,HCHG INTERPRETATION BONE MARROW SMEAR,305.0,305.0,305.0,Sutter Medical Center - Sacramento,2019
2501,43000020,HCHG CLOT RETRACTION,305.0,87.0,87.0,Sutter Medical Center - Sacramento,2019
2502,43000024,HCHG CLOTTING FACTOR VIII 1 STAGE,305.0,152.0,152.0,Sutter Medical Center - Sacramento,2019
2503,43000025,HCHG CLOTTING FACTOR VIII VW FACTOR RISTOCETIN COFACTOR,305.0,446.0,446.0,Sutter Medical Center - Sacramento,2019
2504,43000027,HCHG CLOTTING FACTOR VIII VW FACTOR ANTIGEN,305.0,441.0,441.0,Sutter Medical Center - Sacramento,2019
2505,43000036,HCHG ANTITHROMBIN III ACTIVITY,305.0,194.0,194.0,Sutter Medical Center - Sacramento,2019
2506,43000039,HCHG PROTEIN C ACTIVITY,305.0,169.0,169.0,Sutter Medical Center - Sacramento,2019
2507,43000041,HCHG PROTEIN S ACTIVITY,305.0,132.0,132.0,Sutter Medical Center - Sacramento,2019
2508,43000046,HCHG ACTIVATED CLOTTING TIME,305.0,121.0,121.0,Sutter Medical Center - Sacramento,2019
2509,43000047,HCHG EUGLOBULIN LYSIS,305.0,202.0,202.0,Sutter Medical Center - Sacramento,2019
2510,43000048,HCHG FIBRIN DEGRADATION PROD AGGLTNTN SLIDE SEMIQUAN,305.0,360.0,360.0,Sutter Medical Center - Sacramento,2019
2511,43000049,HCHG FIBRIN MONOMERS,305.0,208.0,208.0,Sutter Medical Center - Sacramento,2019
2512,43000050,HCHG D DIMER SEMI QUANTITATIVE/QUALITATIVE,305.0,312.0,312.0,Sutter Medical Center - Sacramento,2019
2513,43000051,HCHG D DIMER QUANTITATIVE,305.0,264.0,264.0,Sutter Medical Center - Sacramento,2019
2514,43000052,HCHG FIBRINOGEN ACTIVITY,305.0,202.0,202.0,Sutter Medical Center - Sacramento,2019
2515,43000053,HCHG FIBRINOGEN ANTIGEN,305.0,231.0,231.0,Sutter Medical Center - Sacramento,2019
2516,43000054,HCHG ALPHA 2 ANTIPLASMIN,305.0,185.0,185.0,Sutter Medical Center - Sacramento,2019
2517,43000058,HCHG FETAL RBC SMEAR (KLEIHAUER BETKE),305.0,185.0,185.0,Sutter Medical Center - Sacramento,2019
2518,43000059,HCHG FETAL SCREEN ROSETTE,305.0,192.0,192.0,Sutter Medical Center - Sacramento,2019
2519,43000061,HCHG HEPARIN ASSAY,305.0,333.0,333.0,Sutter Medical Center - Sacramento,2019
2520,43000062,HCHG HEPARIN NEUTRALIZATION,305.0,378.0,378.0,Sutter Medical Center - Sacramento,2019
2521,43000064,HCHG LEUKOCYTE ALKALINE PHOSHATASE (LAP),305.0,12.0,12.0,Sutter Medical Center - Sacramento,2019
2522,43000066,HCHG PLATELET AGGREGATION EA AGENT,305.0,254.0,254.0,Sutter Medical Center - Sacramento,2019
2523,43000069,HCHG PLATELET NEUTRALIZATION,305.0,530.0,530.0,Sutter Medical Center - Sacramento,2019
2524,43000070,HCHG PROTHROMBIN TIME,305.0,120.0,77.0,Sutter Medical Center - Sacramento,2019
2525,43000072,HCHG RUSSELL VIPER VENOM DILUTED,305.0,57.0,57.0,Sutter Medical Center - Sacramento,2019
2526,43000074,HCHG SEDIMENTATION RATE MANUAL,305.0,90.0,73.0,Sutter Medical Center - Sacramento,2019
2527,43000075,HCHG SEDIMENTATION RATE AUTOMATED,305.0,84.0,84.0,Sutter Medical Center - Sacramento,2019
2528,43000076,HCHG SICKLE CELL SCREEN,305.0,76.0,76.0,Sutter Medical Center - Sacramento,2019
2529,43000077,HCHG THROMBIN TIME,305.0,66.0,66.0,Sutter Medical Center - Sacramento,2019
2530,43000078,HCHG PTT PLASMA OR WHOLE BLOOD,305.0,169.0,169.0,Sutter Medical Center - Sacramento,2019
2531,43000079,HCHG PTT SUBSTITUTION EA,305.0,145.0,145.0,Sutter Medical Center - Sacramento,2019
2532,43000084,"HCHG OSMOTIC FRAGILITY, NON INCUBATED",305.0,156.0,156.0,Sutter Medical Center - Sacramento,2019
2533,43000085,"HCHG OSMOTIC FRAGILITY ,RBC",305.0,310.0,310.0,Sutter Medical Center - Sacramento,2019
2534,43000089,HCHG DRUG SCREEN CLASS LIST A,301.0,471.0,471.0,Sutter Medical Center - Sacramento,2019
2535,43000096,HCHG HEXGL PHOSPH PLTLT NEUTRL,305.0,530.0,530.0,Sutter Medical Center - Sacramento,2019
2536,43000152,HCHG RETICYTE/HGB CONCENTRATE,305.0,69.0,69.0,Sutter Medical Center - Sacramento,2019
2537,43000153,HCHG FECAL BLOOD SCRN IMMUNOASSAY,301.0,78.0,78.0,Sutter Medical Center - Sacramento,2019
2538,44000000,HCHG ANTIBODY SCREEN,302.0,194.0,194.0,Sutter Medical Center - Sacramento,2019
2539,44000003,HCHG ANTIBODY ELUTION,302.0,225.0,225.0,Sutter Medical Center - Sacramento,2019
2540,44000004,HCHG ANTIBODY ID,302.0,399.0,399.0,Sutter Medical Center - Sacramento,2019
2541,44000005,HCHG COOMBS DIRECT C3,302.0,112.0,112.0,Sutter Medical Center - Sacramento,2019
2542,44000006,HCHG COOMBS DIRECT IGG,302.0,112.0,112.0,Sutter Medical Center - Sacramento,2019
2543,44000007,HCHG COOMBS DIRECT POLYSPECIFIC,302.0,112.0,112.0,Sutter Medical Center - Sacramento,2019
2544,44000009,HCHG ANTIBODY TITER,302.0,239.0,239.0,Sutter Medical Center - Sacramento,2019
2545,44000010,HCHG ABO TYPE SEROLOGIC,302.0,113.0,56.0,Sutter Medical Center - Sacramento,2019
2546,44000011,HCHG RH TYPE SEROLOGIC,302.0,113.0,65.0,Sutter Medical Center - Sacramento,2019
2547,44000013,HCHG BLD TYPE SEROLOGIC SCRN ANTGN EA UNIT PT SERUM,302.0,96.0,96.0,Sutter Medical Center - Sacramento,2019
2548,44000014,HCHG RBC ANTIGENS EA,302.0,129.0,129.0,Sutter Medical Center - Sacramento,2019
2549,44000016,HCHG COMPATIBILITY TEST IMMEDIATE SPIN,302.0,408.0,408.0,Sutter Medical Center - Sacramento,2019
2550,44000017,HCHG COMPATIBILITY TEST INCUBATED,302.0,298.0,298.0,Sutter Medical Center - Sacramento,2019
2551,44000018,HCHG COMPATIBILITY TEST ANTIGLOBULIN,302.0,424.0,424.0,Sutter Medical Center - Sacramento,2019
2552,44000024,HCHG IRRADIATION BLOOD PRODUCT EA,302.0,64.0,64.0,Sutter Medical Center - Sacramento,2019
2553,44000025,HCHG LEUKOCYTE TRANSFUSION,302.0,1207.0,1207.0,Sutter Medical Center - Sacramento,2019
2554,44000026,HCHG POOLING BLOOD PRODUCTS,302.0,362.0,362.0,Sutter Medical Center - Sacramento,2019
2555,44000028,HCHG RBC PRETREATMENT ENZYME,302.0,65.0,65.0,Sutter Medical Center - Sacramento,2019
2556,44000033,HCHG SERUM PRETREATMENT ABSORPTION EA,302.0,107.0,107.0,Sutter Medical Center - Sacramento,2019
2557,44000035,HCHG THAWING PRODUCT PER UNIT,300.0,231.0,231.0,Sutter Medical Center - Sacramento,2019
2558,44000036,HCHG BLOOD TYPE SEROLOGIC ANTGN DONOR EA,302.0,110.0,110.0,Sutter Medical Center - Sacramento,2019
2559,44000038,HCHG RBC L/R CMV NEG IRR PS EA UNIT,390.0,315.0,315.0,Sutter Medical Center - Sacramento,2019
2560,44000041,HCHG CROSS MATCH ELECTRONIC,302.0,321.0,321.0,Sutter Medical Center - Sacramento,2019
2561,44000042,HCHG UNIT ABO CONFIRMATION TESTING,302.0,113.0,56.0,Sutter Medical Center - Sacramento,2019
2562,44000043,HCHG RBC ANTIBODY SCREEN,302.0,194.0,194.0,Sutter Medical Center - Sacramento,2019
2563,44000044,HCHG COOMBS TEST DIRECT,302.0,112.0,112.0,Sutter Medical Center - Sacramento,2019
2564,44000045,HCHG BLOOD TYPING ABO,302.0,113.0,56.0,Sutter Medical Center - Sacramento,2019
2565,45000034,HCHG ASO SCREEN,302.0,78.0,78.0,Sutter Medical Center - Sacramento,2019
2566,45000035,HCHG C REACTIVE PROTEIN,302.0,132.0,89.0,Sutter Medical Center - Sacramento,2019
2567,45000036,HCHG C-REACTIVE PROTEIN HIGH SENSITIVITY,302.0,190.0,158.0,Sutter Medical Center - Sacramento,2019
2568,45000043,HCHG COLD AGGLUTININ SCREEN,302.0,61.0,61.0,Sutter Medical Center - Sacramento,2019
2569,45000044,HCHG COLD AGGLUTININ TITER,302.0,140.0,140.0,Sutter Medical Center - Sacramento,2019
2570,45000048,HCHG COMPLEMENT,302.0,113.0,113.0,Sutter Medical Center - Sacramento,2019
2571,45000092,HCHG CA 15 3 (27.29),302.0,149.0,149.0,Sutter Medical Center - Sacramento,2019
2572,45000094,HCHG CA 125,302.0,208.0,208.0,Sutter Medical Center - Sacramento,2019
2573,45000095,HCHG HETEROPHILE AB SCREEN,302.0,148.0,148.0,Sutter Medical Center - Sacramento,2019
2574,45000106,HCHG IMMUNOFIXATION SERUM,302.0,233.0,233.0,Sutter Medical Center - Sacramento,2019
2575,45000115,HCHG T LYMPH TOTAL COUNT,302.0,186.0,186.0,Sutter Medical Center - Sacramento,2019
2576,45000116,HCHG T LYMPH CD4 AND CD8 COUNT W/ RATIO,302.0,274.0,274.0,Sutter Medical Center - Sacramento,2019
2577,45000117,HCHG T LYMPH CD4 (HELPER) COUNT,302.0,678.0,678.0,Sutter Medical Center - Sacramento,2019
2578,45000126,HCHG RHEUMATOID FACTOR QUALITATIVE,302.0,114.0,114.0,Sutter Medical Center - Sacramento,2019
2579,45000127,HCHG RHEUMATOID FACTOR QUANTITATIVE,302.0,74.0,59.0,Sutter Medical Center - Sacramento,2019
2580,45000128,HCHG RPR QUALITATIVE,302.0,89.0,75.0,Sutter Medical Center - Sacramento,2019
2581,45000130,HCHG RPR TITER,302.0,37.0,37.0,Sutter Medical Center - Sacramento,2019
2582,45000164,HCHG CMV AB,302.0,61.0,61.0,Sutter Medical Center - Sacramento,2019
2583,45000166,HCHG CMV AB IGM,302.0,117.0,117.0,Sutter Medical Center - Sacramento,2019
2584,45000182,HCHG EBV AB EARLY AG,302.0,90.0,90.0,Sutter Medical Center - Sacramento,2019
2585,45000183,HCHG EBV AB EBNA,302.0,117.0,117.0,Sutter Medical Center - Sacramento,2019
2586,45000185,HCHG EBV VCA AB IGG,302.0,157.0,157.0,Sutter Medical Center - Sacramento,2019
2587,45000186,HCHG EBV VCA AB IGM,302.0,157.0,157.0,Sutter Medical Center - Sacramento,2019
2588,45000198,HCHG H PYLORI AB,302.0,88.0,88.0,Sutter Medical Center - Sacramento,2019
2589,45000205,HCHG HTLV 1 AB,302.0,143.0,143.0,Sutter Medical Center - Sacramento,2019
2590,45000206,HCHG HTLV II AB,302.0,274.0,274.0,Sutter Medical Center - Sacramento,2019
2591,45000207,HCHG HIV AB CONFIRMATION WESTERN BLOT,302.0,109.0,109.0,Sutter Medical Center - Sacramento,2019
2592,45000217,HCHG HIV 1 AB,302.0,111.0,111.0,Sutter Medical Center - Sacramento,2019
2593,45000218,HCHG HIV 2 AB,302.0,97.0,97.0,Sutter Medical Center - Sacramento,2019
2594,45000219,HCHG HIV 1/HIV 2 AB,302.0,159.0,133.0,Sutter Medical Center - Sacramento,2019
2595,45000220,HCHG HEPATITIS B CORE AB TOTAL,302.0,135.0,135.0,Sutter Medical Center - Sacramento,2019
2596,45000221,HCHG HEPATITIS B CORE AB IGM,302.0,131.0,131.0,Sutter Medical Center - Sacramento,2019
2597,45000222,HCHG HEPATITIS B SURFACE AB,302.0,125.0,104.0,Sutter Medical Center - Sacramento,2019
2598,45000223,HCHG HEPATITIS BE AB,302.0,251.0,251.0,Sutter Medical Center - Sacramento,2019
2599,45000224,HCHG HEPATITIS A AB TOTAL,302.0,122.0,122.0,Sutter Medical Center - Sacramento,2019
2600,45000225,HCHG HEPATITIS A AB IGM,302.0,136.0,136.0,Sutter Medical Center - Sacramento,2019
2601,45000254,HCHG RUBELLA AB,302.0,92.0,92.0,Sutter Medical Center - Sacramento,2019
2602,45000264,HCHG FTA ABS (TPPA),302.0,97.0,97.0,Sutter Medical Center - Sacramento,2019
2603,45000277,HCHG THYROGLOBULIN AB,302.0,110.0,89.0,Sutter Medical Center - Sacramento,2019
2604,45000278,HCHG HEPATITIS C  AB,302.0,147.0,123.0,Sutter Medical Center - Sacramento,2019
2605,45000279,HCHG HEPATITIS C AB CONFIRMATION,302.0,292.0,292.0,Sutter Medical Center - Sacramento,2019
2606,45000295,HCHG HLA TYPE A B OR C MULTIPLE ANTIGENS,302.0,1118.0,1118.0,Sutter Medical Center - Sacramento,2019
2607,45000296,HCHG HLA TYPE DR/DQ MULTIPLE ANTIGENS,302.0,1347.0,1347.0,Sutter Medical Center - Sacramento,2019
2608,45000344,HCHG HEP C SCREEN HIGH RISK/OTHER,302.0,139.0,139.0,Sutter Medical Center - Sacramento,2019
2609,45000601,HCHG PPD SKIN TEST,302.0,72.0,72.0,Sutter Medical Center - Sacramento,2019
2610,45000634,HCHG CD34 TOTAL COUNT,302.0,793.0,793.0,Sutter Medical Center - Sacramento,2019
2611,45000636,HCHG HETEROPHILE ANTIBODIES SCREENING,302.0,148.0,148.0,Sutter Medical Center - Sacramento,2019
2612,46000001,HCHG CULTURE BLOOD,306.0,351.0,351.0,Sutter Medical Center - Sacramento,2019
2613,46000002,HCHG CULTURE STOOL SALMONELLA AND  SHIGELLA,306.0,225.0,135.0,Sutter Medical Center - Sacramento,2019
2614,46000025,HCHG CULT OTHER SOURCE AEROBIC NOT UR/BLD/STL,306.0,220.0,127.0,Sutter Medical Center - Sacramento,2019
2615,46000029,HCHG CULTURE SPUTUM,306.0,220.0,127.0,Sutter Medical Center - Sacramento,2019
2616,46000036,HCHG CULTURE BACTERIAL ANAEROBIC NOT BLOOD,306.0,206.0,206.0,Sutter Medical Center - Sacramento,2019
2617,46000040,HCHG CULTURE BACTERIAL ANAEROBIC ID,306.0,163.0,163.0,Sutter Medical Center - Sacramento,2019
2618,46000041,HCHG CULTURE BACTERIAL AEROBIC ID,306.0,123.0,123.0,Sutter Medical Center - Sacramento,2019
2619,46000053,HCHG CULTURE URINE COLONY COUNT ONLY,306.0,149.0,121.0,Sutter Medical Center - Sacramento,2019
2620,46000054,HCHG CULTURE URINE ID EA ISOLATE,306.0,126.0,126.0,Sutter Medical Center - Sacramento,2019
2621,46000058,HCHG CULTURE FUNGUS YEAST ID,306.0,168.0,168.0,Sutter Medical Center - Sacramento,2019
2622,46000072,HCHG CULTURE TYPING IMMUNOLOGIC,306.0,92.0,92.0,Sutter Medical Center - Sacramento,2019
2623,46000080,HCHG TISSUE HOMOGENIZATION,306.0,85.0,85.0,Sutter Medical Center - Sacramento,2019
2624,46000081,HCHG OVA AND PARASITES W/ CONCENTRATION,306.0,119.0,99.0,Sutter Medical Center - Sacramento,2019
2625,46000083,HCHG SUSCEPTIBILITY KB DISK LESS THAN OR EQUAL TO 12 AGENTS,306.0,128.0,128.0,Sutter Medical Center - Sacramento,2019
2626,46000084,HCHG SUSCEPTIBILITY BY ENZYME DETECT,306.0,49.0,49.0,Sutter Medical Center - Sacramento,2019
2627,46000085,HCHG SUSCEPTIBILITY BY MIC,306.0,187.0,187.0,Sutter Medical Center - Sacramento,2019
2628,46000088,HCHG SMEAR GRAM STAIN,306.0,110.0,110.0,Sutter Medical Center - Sacramento,2019
2629,46000089,HCHG SMEAR WRIGHT STAIN,306.0,110.0,110.0,Sutter Medical Center - Sacramento,2019
2630,46000090,HCHG STOOL FOR WBC'S,306.0,110.0,110.0,Sutter Medical Center - Sacramento,2019
2631,46000098,HCHG SMEAR COMPLEX STAIN OVA AND PARASITE,306.0,136.0,136.0,Sutter Medical Center - Sacramento,2019
2632,46000100,HCHG SMEAR WET MOUNT,306.0,190.0,190.0,Sutter Medical Center - Sacramento,2019
2633,46000101,HCHG KOH PREP SKIN HAIR NAIL,306.0,129.0,129.0,Sutter Medical Center - Sacramento,2019
2634,46000129,HCHG PNEUMOCYSTIS CARINII DFA,306.0,254.0,254.0,Sutter Medical Center - Sacramento,2019
2635,46000131,HCHG C DIFFICILE TOXIN EIA,306.0,163.0,163.0,Sutter Medical Center - Sacramento,2019
2636,46000134,HCHG GIARDIA AG EIA,306.0,125.0,125.0,Sutter Medical Center - Sacramento,2019
2637,46000139,HCHG H PYLORI (NOT STOOL) EIA,306.0,78.0,78.0,Sutter Medical Center - Sacramento,2019
2638,46000140,HCHG HEPATITIS B SURFACE AG,306.0,132.0,110.0,Sutter Medical Center - Sacramento,2019
2639,46000141,HCHG HEPATITIS B SURFACE AG NEUTRALIZATION,306.0,36.0,36.0,Sutter Medical Center - Sacramento,2019
2640,46000142,HCHG HEPATITIS BE AG,306.0,217.0,217.0,Sutter Medical Center - Sacramento,2019
2641,46000145,HCHG HIV P24 AG,306.0,348.0,348.0,Sutter Medical Center - Sacramento,2019
2642,46000146,HCHG INFLUENZA AG A OR B EA,306.0,183.0,183.0,Sutter Medical Center - Sacramento,2019
2643,46000147,HCHG RSV AG EIA,306.0,317.0,317.0,Sutter Medical Center - Sacramento,2019
2644,46000150,HCHG STREP GROUP A AG EIA,306.0,178.0,178.0,Sutter Medical Center - Sacramento,2019
2645,46000162,HCHG HEPATITIS B VIRUS AMPLIFIED PROBE,306.0,660.0,660.0,Sutter Medical Center - Sacramento,2019
2646,46000167,HCHG HEP C VIRUS AMP PROBE W/WO REVERSE TRANS,306.0,213.0,213.0,Sutter Medical Center - Sacramento,2019
2647,46000171,HCHG HSV AMPLIFIED PROBE,306.0,328.0,328.0,Sutter Medical Center - Sacramento,2019
2648,46000173,HCHG IADNA HIV-1 AMP PROBE W/WO REVRS TRNSCRP,306.0,660.0,660.0,Sutter Medical Center - Sacramento,2019
2649,46000210,HCHG AG DETECT NOS DNA AMP,306.0,328.0,328.0,Sutter Medical Center - Sacramento,2019
2650,46000215,HCHG AG DETECT EIA MULT STEP,306.0,133.0,133.0,Sutter Medical Center - Sacramento,2019
2651,46000219,HCHG HIV-1 AG W/HIV-1/HIV-2 AB,306.0,228.0,228.0,Sutter Medical Center - Sacramento,2019
2652,46000229,HCHG INFLUENZA DNA AMP PROBE,306.0,472.0,472.0,Sutter Medical Center - Sacramento,2019
2653,46000241,HCHG STREP SCREEN,306.0,149.0,111.0,Sutter Medical Center - Sacramento,2019
2654,46000242,HCHG CULTR BACTERIA EXCEPT BLOOD,306.0,206.0,206.0,Sutter Medical Center - Sacramento,2019
2655,46000243,HCHG SMEAR GRAM STAIN,306.0,110.0,110.0,Sutter Medical Center - Sacramento,2019
2656,46000244,HCHG AGENT NOS ASSAY W/OPTIC,306.0,164.0,164.0,Sutter Medical Center - Sacramento,2019
2657,46000246,HCHG CNS DNA AMP PROBE TYPE 12-25,306.0,622.0,622.0,Sutter Medical Center - Sacramento,2019
2658,47000000,HCHG URINALYSIS MANUAL W/ MICROSCOPIC EXAM,307.0,40.0,37.0,Sutter Medical Center - Sacramento,2019
2659,47000001,HCHG URINALYSIS AUTOMATED W/ MICROSCOPIC EXAM,307.0,111.0,66.0,Sutter Medical Center - Sacramento,2019
2660,47000002,HCHG SPECIFIC GRAVITY URINE,307.0,45.0,31.0,Sutter Medical Center - Sacramento,2019
2661,47000003,HCHG URINALYSIS MANUAL W/OUT MICROSCOPIC EXAM,307.0,45.0,31.0,Sutter Medical Center - Sacramento,2019
2662,47000005,HCHG URINALYSIS SINGLE ASSAY,307.0,45.0,31.0,Sutter Medical Center - Sacramento,2019
2663,47000006,HCHG URINALYSIS AUTOMATED W/OUT  MICROSCOPIC EXAM,307.0,74.0,74.0,Sutter Medical Center - Sacramento,2019
2664,47000007,HCHG URINALYSIS QUALITATIVE OR SEMI QUANTITATIVE,307.0,55.0,55.0,Sutter Medical Center - Sacramento,2019
2665,47000008,HCHG MICROSCOPIC EXAM URINE,307.0,50.0,42.0,Sutter Medical Center - Sacramento,2019
2666,47000010,HCHG PREGNANCY SCREEN URINE,307.0,132.0,77.0,Sutter Medical Center - Sacramento,2019
2667,47000011,HCHG URINALYSIS VOLUME MEASUREMENT TIMED COLLECTION,307.0,46.0,46.0,Sutter Medical Center - Sacramento,2019
2668,47000016,HCHG URINALYSIS DIP W/O SCOPE,307.0,45.0,31.0,Sutter Medical Center - Sacramento,2019
2669,47100001,HCHG VENIPUNCTURE,309.0,38.0,32.0,Sutter Medical Center - Sacramento,2019
2670,47100002,HCHG OBS VENIPUNCTURE,760.0,34.0,34.0,Sutter Medical Center - Sacramento,2019
2671,47100003,HCHG CAPILLARY PUNCTURE,300.0,45.0,45.0,Sutter Medical Center - Sacramento,2019
2672,47100004,HCHG CELL COUNT FLUID W/OUT DIFF,309.0,138.0,138.0,Sutter Medical Center - Sacramento,2019
2673,47100005,HCHG CELL COUNT FLUID W/ DIFF,309.0,181.0,181.0,Sutter Medical Center - Sacramento,2019
2674,47100006,HCHG CRYSTAL ID TISSUE/FLUID NOT URINE,309.0,153.0,153.0,Sutter Medical Center - Sacramento,2019
2675,47100008,HCHG EOSINPHILS SMEAR NASAL,309.0,118.0,118.0,Sutter Medical Center - Sacramento,2019
2676,47100011,HCHG SEMEN MOTILITY/COUNT (NO HUHNER),309.0,119.0,119.0,Sutter Medical Center - Sacramento,2019
2677,47100012,HCHG SEMEN ANALYSIS COMPLETE,309.0,215.0,215.0,Sutter Medical Center - Sacramento,2019
2678,47100013,HCHG SEMEN PRESENCE/MOTILITY,309.0,144.0,144.0,Sutter Medical Center - Sacramento,2019
2679,47100015,HCHG SPECIMEN HANDLING FEE,309.0,50.0,50.0,Sutter Medical Center - Sacramento,2019
2680,47100016,HCHG ARTERIAL PUNCTURE,309.0,241.0,241.0,Sutter Medical Center - Sacramento,2019
2681,47100017,HCHG SPUTUM SPEC VIA AEROSOL,300.0,523.0,523.0,Sutter Medical Center - Sacramento,2019
2682,47100060,HCHG KIT DRAW,309.0,50.0,50.0,Sutter Medical Center - Sacramento,2019
2683,47100062,HCHG SPEC HANDL LGL BLD ALC,309.0,50.0,50.0,Sutter Medical Center - Sacramento,2019
2684,47100067,HCHG CELL MARKER STUDY,311.0,635.0,635.0,Sutter Medical Center - Sacramento,2019
2685,48100001,HCHG CYTOLOGY FLUID,311.0,113.0,113.0,Sutter Medical Center - Sacramento,2019
2686,48100005,HCHG CYTOLOGY CONCENTRATION TECHNIQUE,311.0,151.0,151.0,Sutter Medical Center - Sacramento,2019
2687,48100006,HCHG CYTOLOGY SELECTIVE CELLULAR ENHANCEMENT,311.0,147.0,147.0,Sutter Medical Center - Sacramento,2019
2688,48100010,HCHG CYTOLOGY SMEARS PREPARATION & INTERPRETATION,311.0,123.0,123.0,Sutter Medical Center - Sacramento,2019
2689,48100012,HCHG FNA ADEQUACY EVALUATION,311.0,194.0,194.0,Sutter Medical Center - Sacramento,2019
2690,48100013,HCHG FNA INTERPRETATION AND REPORT,311.0,186.0,186.0,Sutter Medical Center - Sacramento,2019
2691,48100016,HCHG DNA CELL CYCLE,311.0,635.0,635.0,Sutter Medical Center - Sacramento,2019
2692,48100018,HCHG CELL MARKER TECHNICAL COMPONENT 1ST CELL MARKER,311.0,267.0,223.0,Sutter Medical Center - Sacramento,2019
2693,48100019,HCHG CELL MARKER TECHNICAL COMPONENT EA ADDL MARKER,311.0,26.0,21.0,Sutter Medical Center - Sacramento,2019
2694,48100026,HCHG CYTOLOGY CSF SMR,311.0,113.0,113.0,Sutter Medical Center - Sacramento,2019
2695,48200000,HCHG TISSUE CULTURE LYMPHOCYTE,311.0,258.0,258.0,Sutter Medical Center - Sacramento,2019
2696,48200001,HCHG TISSUE CULTURE SKIN,311.0,679.0,679.0,Sutter Medical Center - Sacramento,2019
2697,48200002,HCHG TISSUE CULTURE AMNIO/CVS,311.0,627.0,627.0,Sutter Medical Center - Sacramento,2019
2698,48200003,HCHG TISSUE CULTURE BONE MARROW/BLOOD,311.0,210.0,210.0,Sutter Medical Center - Sacramento,2019
2699,48200005,HCHG CHR0MOSOME COUNT KARYOTYPE 5 CELLS/ 1 KARYOTYPE,311.0,803.0,803.0,Sutter Medical Center - Sacramento,2019
2700,48200006,HCHG CHRMOSOME COUNT 15-20 CELLS/ 1 KARYOTYPE,311.0,299.0,299.0,Sutter Medical Center - Sacramento,2019
2701,48200009,HCHG CHROMOSOME COUNT AMNIOTIC FLUID 15 CELLS/1 KARYOTYPE,311.0,1877.0,1877.0,Sutter Medical Center - Sacramento,2019
