,EAP,Description,Revenue Code,Inpatient Price,Outpatient Price,Hospital,Year
564,30300024,HCHG MRI SPINE THOR W CONTR,612.0,5279.0,5279.0,Sutter Coast Hospital,2019
565,30300025,HCHG MRI SPINE LUMB WO CONTR,612.0,3767.0,3752.0,Sutter Coast Hospital,2019
566,30300026,HCHG MRI SPINE LUMB W CONTR,612.0,5470.0,5470.0,Sutter Coast Hospital,2019
567,30300027,HCHG MRI SPINE CERV W AND WO CONTR,612.0,5940.0,5940.0,Sutter Coast Hospital,2019
568,30300028,HCHG MRI SPINE THOR W AND WO CONTR,612.0,5905.0,5905.0,Sutter Coast Hospital,2019
569,30300029,HCHG MRI SPINE LUMB W AND WO CONTR,612.0,6072.0,6072.0,Sutter Coast Hospital,2019
570,30300031,HCHG MRI PELVIS WO CONTR,610.0,3797.0,3697.0,Sutter Coast Hospital,2019
571,30300032,HCHG MRI PELVIS W CONTR,610.0,4933.0,4933.0,Sutter Coast Hospital,2019
572,30300033,HCHG MRI PELVIS W AND WO CONTR,610.0,5742.0,5741.0,Sutter Coast Hospital,2019
573,30300034,HCHG MRI EXTREM UPPER NO JOINT WO CONTR BIL,610.0,4611.0,4611.0,Sutter Coast Hospital,2019
574,30300035,HCHG MRI EXTREM UPPER NO JOINT WO CONTR LT,610.0,3074.0,3074.0,Sutter Coast Hospital,2019
575,30300036,HCHG MRI EXTREM UPPER NO JOINT WO CONTR RT,610.0,3074.0,3074.0,Sutter Coast Hospital,2019
576,30300037,HCHG MRI EXTREM UPPER NO JOINT W CONTR BIL,610.0,3746.0,3746.0,Sutter Coast Hospital,2019
577,30300038,HCHG MRI EXTREM UPPER NO JOINT W CONTR LT,610.0,2497.0,2497.0,Sutter Coast Hospital,2019
578,30300039,HCHG MRI EXTREM UPPER NO JOINT W CONTR RT,610.0,2497.0,2497.0,Sutter Coast Hospital,2019
579,30300040,HCHG MRI EXTREM UPPER NO JOINT W AND WO CONTR BIL,610.0,6774.0,6774.0,Sutter Coast Hospital,2019
580,30300041,HCHG MRI EXTREM UPPER NO JOINT W AND WO CONTR LT,610.0,4516.0,4516.0,Sutter Coast Hospital,2019
581,30300042,HCHG MRI EXTREM UPPER NO JOINT W AND WO CONTR RT,610.0,4516.0,4516.0,Sutter Coast Hospital,2019
582,30300043,HCHG MRI EXTREM UPPER JOINT WO CONTR BIL,610.0,5114.0,4936.0,Sutter Coast Hospital,2019
583,30300044,HCHG MRI EXTREM UPPER JOINT WO CONTR LT,610.0,3409.0,3291.0,Sutter Coast Hospital,2019
584,30300045,HCHG MRI EXTREM UPPER JOINT WO CONTR RT,610.0,3409.0,3291.0,Sutter Coast Hospital,2019
585,30300046,HCHG MRI EXTREM UPPER JOINT W CONTR BIL,610.0,5904.0,5664.0,Sutter Coast Hospital,2019
586,30300047,HCHG MRI EXTREM UPPER JOINT W CONTR LT,610.0,3936.0,3776.0,Sutter Coast Hospital,2019
587,30300048,HCHG MRI EXTREM UPPER JOINT W CONTR RT,610.0,3936.0,3776.0,Sutter Coast Hospital,2019
588,30300049,HCHG MRI EXTREM UPPER JOINT W AND WO CONTR BIL,610.0,8060.0,8060.0,Sutter Coast Hospital,2019
589,30300050,HCHG MRI EXTREM UPPER JOINT W AND WO CONTR LT,610.0,5373.0,5373.0,Sutter Coast Hospital,2019
590,30300051,HCHG MRI EXTREM UPPER JOINT W AND WO CONTR RT,610.0,5373.0,5373.0,Sutter Coast Hospital,2019
591,30300055,HCHG MRI EXTREM LOWER WO CONTR BIL,610.0,4833.0,4833.0,Sutter Coast Hospital,2019
592,30300056,HCHG MRI EXTREM LOWER WO CONTR LT,610.0,3222.0,3222.0,Sutter Coast Hospital,2019
593,30300057,HCHG MRI EXTREM LOWER WO CONTR RT,610.0,3222.0,3222.0,Sutter Coast Hospital,2019
594,30300058,HCHG MRI EXTREM LOWER NO JOINT W CONTR BIL,610.0,5614.0,5614.0,Sutter Coast Hospital,2019
595,30300059,HCHG MRI EXTREM LOWER NO JOINT W CONTR LT,610.0,3743.0,3743.0,Sutter Coast Hospital,2019
596,30300060,HCHG MRI EXTREM LOWER NO JOINT W CONTR RT,610.0,3743.0,3743.0,Sutter Coast Hospital,2019
597,30300061,HCHG MRI EXTREM LOWER W AND WO CONTR BIL,610.0,7605.0,7605.0,Sutter Coast Hospital,2019
598,30300062,HCHG MRI EXTREM LOWER W AND WO CONTR LT,610.0,5070.0,5070.0,Sutter Coast Hospital,2019
599,30300063,HCHG MRI EXTREM LOWER W AND WO CONTR RT,610.0,5070.0,5070.0,Sutter Coast Hospital,2019
600,30300064,HCHG MRI EXTREM LOWER JOINT WO CONTR BIL,610.0,5446.0,5446.0,Sutter Coast Hospital,2019
601,30300065,HCHG MRI EXTREM LOWER JOINT WO CONTR LT,610.0,3631.0,3631.0,Sutter Coast Hospital,2019
602,30300066,HCHG MRI EXTREM LOWER JOINT WO CONTR RT,610.0,3631.0,3631.0,Sutter Coast Hospital,2019
603,30300067,HCHG MRI EXTREM LOWER JOINT W CONTR BIL,610.0,6490.0,6490.0,Sutter Coast Hospital,2019
604,30300068,HCHG MRI EXTREM LOWER JOINT W CONTR LT,610.0,4327.0,4327.0,Sutter Coast Hospital,2019
605,30300069,HCHG MRI EXTREM LOWER JOINT W CONTR RT,610.0,4327.0,4327.0,Sutter Coast Hospital,2019
606,30300070,HCHG MRI EXTREM LOWER JOINT W AND WO CONTR BIL,610.0,8548.0,8548.0,Sutter Coast Hospital,2019
607,30300071,HCHG MRI EXTREM LOWER JOINT W AND WO CONTR LT,610.0,5699.0,5699.0,Sutter Coast Hospital,2019
608,30300072,HCHG MRI EXTREM LOWER JOINT W AND WO CONTR RT,610.0,5699.0,5699.0,Sutter Coast Hospital,2019
609,30300073,HCHG MRI ABDOMEN WO CONTR,610.0,3350.0,3350.0,Sutter Coast Hospital,2019
610,30300074,HCHG MRI ABDOMEN W CONTR,610.0,3924.0,3924.0,Sutter Coast Hospital,2019
611,30300075,HCHG MRI ABDOMEN W AND WO CONTR,610.0,5258.0,5258.0,Sutter Coast Hospital,2019
612,30300080,HCHG MR 3D RENDERING INTERP & POSTPROCESS SUPERVISION,610.0,1073.0,1073.0,Sutter Coast Hospital,2019
613,30300085,HCHG MRA ABD W CON,618.0,2614.0,2614.0,Sutter Coast Hospital,2019
614,30300086,HCHG MRA ABD W/O CON,618.0,3292.0,3292.0,Sutter Coast Hospital,2019
615,30300087,HCHG MRA ABD W-W/O CON,618.0,3615.0,3615.0,Sutter Coast Hospital,2019
616,30300097,HCHG MRA EXT LOW W CON,616.0,3041.0,3041.0,Sutter Coast Hospital,2019
617,30300100,HCHG MRA PELVIS W CON,618.0,6816.0,6816.0,Sutter Coast Hospital,2019
618,30300101,HCHG MRA PELVIS W/O CON,618.0,3286.0,3286.0,Sutter Coast Hospital,2019
619,30300102,HCHG MRA PELVIS W-W/O CON,618.0,4493.0,4493.0,Sutter Coast Hospital,2019
620,30300136,HCHG MRA UPPER EXT W-WO CON,618.0,3700.0,3700.0,Sutter Coast Hospital,2019
621,30300152,HCHG MRA EXT LOW W-W/O CON LT,616.0,3751.0,3751.0,Sutter Coast Hospital,2019
622,30300153,HCHG MRA EXT LOW W-W/O CON RT,616.0,3751.0,3751.0,Sutter Coast Hospital,2019
623,30400002,HCHG CT PERFUSION ANALYSIS CEREBRAL WITH CONTRAST,351.0,5156.0,5156.0,Sutter Coast Hospital,2019
624,30400012,HCHG CT BRAIN WO CONTR,351.0,3400.0,2674.0,Sutter Coast Hospital,2019
625,30400013,HCHG CT BRAIN W CONTR,351.0,3614.0,3495.0,Sutter Coast Hospital,2019
626,30400014,HCHG CT BRAIN W AND WO CONTR,351.0,3875.0,3394.0,Sutter Coast Hospital,2019
627,30400015,HCHG CT ORBIT AND SELLA FOSSA WO CONTR,351.0,2930.0,2930.0,Sutter Coast Hospital,2019
628,30400016,HCHG CT ORBIT AND SELLA FOSSA W CONTR,351.0,3525.0,3525.0,Sutter Coast Hospital,2019
629,30400017,HCHG CT ORBIT AND SELLA FOSSA W AND WO CONTR,351.0,3769.0,3769.0,Sutter Coast Hospital,2019
630,30400019,HCHG CT MAXILLOFACIAL WO CONTR,351.0,3135.0,3135.0,Sutter Coast Hospital,2019
631,30400020,HCHG CT MAXILLOFACIAL W CONTR,351.0,4069.0,4040.0,Sutter Coast Hospital,2019
632,30400021,HCHG CT MAXILLOFACIAL W AND WO CONTR,351.0,3697.0,3081.0,Sutter Coast Hospital,2019
633,30400022,HCHG CT NECK WO CONTR,351.0,2857.0,2857.0,Sutter Coast Hospital,2019
634,30400023,HCHG CT NECK W CONTR,351.0,3362.0,3362.0,Sutter Coast Hospital,2019
635,30400024,HCHG CT NECK W AND WO CONTR,351.0,3260.0,3260.0,Sutter Coast Hospital,2019
636,30400025,HCHG CTA HEAD/BRAIN W AND WO CONTR,351.0,5104.0,4953.0,Sutter Coast Hospital,2019
637,30400026,HCHG CTA NECK W AND WO CONTR,351.0,4005.0,4005.0,Sutter Coast Hospital,2019
638,30400027,HCHG CT CHEST WO CONTR,352.0,2882.0,2778.0,Sutter Coast Hospital,2019
639,30400029,HCHG CT CHEST W CONTR,352.0,4053.0,4053.0,Sutter Coast Hospital,2019
640,30400030,HCHG CT CHEST W AND WO CONTR,352.0,4894.0,4894.0,Sutter Coast Hospital,2019
641,30400031,HCHG CTA CHEST W AND WO CONTR,350.0,5426.0,5426.0,Sutter Coast Hospital,2019
642,30400032,HCHG CT SPINE CERV WO CONTR,352.0,4129.0,3516.0,Sutter Coast Hospital,2019
643,30400033,HCHG CT SPINE CERV W CONTR,352.0,3710.0,3710.0,Sutter Coast Hospital,2019
644,30400034,HCHG CT SPINE CERV W AND WO CONTR,352.0,4085.0,4085.0,Sutter Coast Hospital,2019
645,30400035,HCHG CT SPINE THOR WO CONTR,352.0,3693.0,3495.0,Sutter Coast Hospital,2019
646,30400036,HCHG CT SPINE THOR W CONTR,352.0,3672.0,3672.0,Sutter Coast Hospital,2019
647,30400037,HCHG CT SPINE THOR W AND WO CONTR,352.0,5172.0,5172.0,Sutter Coast Hospital,2019
648,30400038,HCHG CT SPINE LUMB WO CONTR,352.0,3789.0,3481.0,Sutter Coast Hospital,2019
649,30400039,HCHG CT SPINE LUMB W CONTR,352.0,3720.0,3720.0,Sutter Coast Hospital,2019
650,30400040,HCHG CT SPINE LUMB W AND WO CONTR,352.0,4206.0,4206.0,Sutter Coast Hospital,2019
651,30400042,HCHG CTA PELVIS W AND WO CONTR,350.0,3608.0,3608.0,Sutter Coast Hospital,2019
652,30400043,HCHG CT PELVIS WO CONTR,352.0,3745.0,2624.0,Sutter Coast Hospital,2019
653,30400044,HCHG CT PELVIS W CONTR,352.0,3723.0,3723.0,Sutter Coast Hospital,2019
654,30400045,HCHG CT PELVIS W AND WO CONTR,352.0,3929.0,3445.0,Sutter Coast Hospital,2019
655,30400047,HCHG CT EXTREM UPPER WO CONTR BIL,352.0,4188.0,4188.0,Sutter Coast Hospital,2019
656,30400048,HCHG CT EXTREM UPPER WO CONTR LT,352.0,2792.0,2792.0,Sutter Coast Hospital,2019
657,30400049,HCHG CT EXTREM UPPER WO CONTR RT,352.0,2792.0,2792.0,Sutter Coast Hospital,2019
658,30400050,HCHG CT EXTREM UPPER W CONTR BIL,352.0,4412.0,4412.0,Sutter Coast Hospital,2019
659,30400051,HCHG CT EXTREM UPPER W CONTR LT,352.0,2941.0,2941.0,Sutter Coast Hospital,2019
660,30400052,HCHG CT EXTREM UPPER W CONTR RT,352.0,2941.0,2941.0,Sutter Coast Hospital,2019
661,30400053,HCHG CT EXTREM UPPER W AND WO CONTR BIL,352.0,4899.0,4899.0,Sutter Coast Hospital,2019
662,30400054,HCHG CT EXTREM UPPER W AND WO CONTR LT,352.0,3266.0,3266.0,Sutter Coast Hospital,2019
663,30400055,HCHG CT EXTREM UPPER W AND WO CONTR RT,352.0,3266.0,3266.0,Sutter Coast Hospital,2019
664,30400056,HCHG CTA EXTREM UPPER W AND WO CONTR LT,350.0,4061.0,4061.0,Sutter Coast Hospital,2019
665,30400057,HCHG CTA EXTREM UPPER W AND WO CONTR RT,350.0,4061.0,4061.0,Sutter Coast Hospital,2019
666,30400058,HCHG CT EXTREM LOWER WO CONTR BIL,352.0,4028.0,4028.0,Sutter Coast Hospital,2019
667,30400059,HCHG CT EXTREM LOWER WO CONTR LT,352.0,2685.0,2685.0,Sutter Coast Hospital,2019
668,30400060,HCHG CT EXTREM LOWER WO CONTR RT,352.0,2685.0,2685.0,Sutter Coast Hospital,2019
669,30400061,HCHG CT EXTREM LOWER W CONTR BIL,352.0,5271.0,5271.0,Sutter Coast Hospital,2019
670,30400062,HCHG CT EXTREM LOWER W CONTR LT,352.0,3514.0,3514.0,Sutter Coast Hospital,2019
671,30400063,HCHG CT EXTREM LOWER W CONTR RT,352.0,3514.0,3514.0,Sutter Coast Hospital,2019
672,30400064,HCHG CT EXTREM LOWER W AND WO CONTR BIL,352.0,3735.0,3735.0,Sutter Coast Hospital,2019
673,30400065,HCHG CT EXTREM LOWER W AND WO CONTR LT,352.0,2490.0,2490.0,Sutter Coast Hospital,2019
674,30400066,HCHG CT EXTREM LOWER W AND WO CONTR RT,352.0,2490.0,2490.0,Sutter Coast Hospital,2019
675,30400067,HCHG CTA EXTREM LOWER W AND WO CONTR BIL,350.0,5970.0,5970.0,Sutter Coast Hospital,2019
676,30400068,HCHG CTA EXTREM LOWER W AND WO CONTR LT,350.0,3980.0,3980.0,Sutter Coast Hospital,2019
677,30400069,HCHG CTA EXTREM LOWER W AND WO CONTR RT,350.0,3980.0,3980.0,Sutter Coast Hospital,2019
678,30400070,HCHG CT ABD WO CONTR,352.0,3159.0,2588.0,Sutter Coast Hospital,2019
679,30400071,HCHG CT ABD W CONTR,352.0,3663.0,3595.0,Sutter Coast Hospital,2019
680,30400072,HCHG CT ABD W AND WO CONTR,352.0,4319.0,4302.0,Sutter Coast Hospital,2019
681,30400073,HCHG CTA ABD W AND WO CONTR,350.0,4363.0,4363.0,Sutter Coast Hospital,2019
682,30400074,HCHG CTA ABD W RUNOFF W AND WO CONTR,350.0,4281.0,4281.0,Sutter Coast Hospital,2019
683,30400076,HCHG CT 3D RENDERING INTERP&POSTPROC DIF WORK STATION,350.0,1290.0,1290.0,Sutter Coast Hospital,2019
684,30400077,HCHG CT LTD OR FOLLOW-UP STDY,350.0,1738.0,1738.0,Sutter Coast Hospital,2019
685,30400080,HCHG CT GUIDE NEEDLE PLACEMENT,350.0,2946.0,2946.0,Sutter Coast Hospital,2019
686,30400104,HCHG CT LOW DOSE CT LUNG SCREENING,350.0,242.0,242.0,Sutter Coast Hospital,2019
687,30400115,HCHG CT ABD & PELVIS W/O CON,352.0,5399.0,3135.0,Sutter Coast Hospital,2019
688,30400116,HCHG CT ABD & PELVIS W/CON,352.0,6482.0,5539.0,Sutter Coast Hospital,2019
689,30400117,HCHG CT ABD & PELVIS 1+ REGION W/WO CONTRAST,352.0,6692.0,6550.0,Sutter Coast Hospital,2019
690,30400127,HCHG CT DRN W CATH PLACE PRC,350.0,2103.0,2103.0,Sutter Coast Hospital,2019
691,30400133,HCHG DIAGNOSTIC BONE MARROW ASPIRATION,361.0,1545.0,1545.0,Sutter Coast Hospital,2019
692,30400136,HCHG CT LUNG SCREENING LTD,352.0,2882.0,2778.0,Sutter Coast Hospital,2019
693,30400138,HCHG CT BONE LENGTH STUDY,350.0,466.0,466.0,Sutter Coast Hospital,2019
694,30600009,HCHG NM PARATHYROID PLANAR IMAGING,341.0,1713.0,1713.0,Sutter Coast Hospital,2019
695,30600019,HCHG NM LYMPHATIC PATHWAY WITH IMAGING,341.0,2927.0,2927.0,Sutter Coast Hospital,2019
696,30600022,HCHG NM LIVER W SPECT,341.0,2177.0,2177.0,Sutter Coast Hospital,2019
697,30600024,HCHG NM LIVER SPLEEN SCAN,341.0,2160.0,2160.0,Sutter Coast Hospital,2019
698,30600025,HCHG NM LIVER SPLEEN W FLOW,341.0,1382.0,1382.0,Sutter Coast Hospital,2019
699,30600027,HCHG NM SALIVARY GLAND W SERIAL,341.0,1196.0,1196.0,Sutter Coast Hospital,2019
700,30600029,HCHG NM GASTROESOPHAGEAL REFLUX,341.0,2604.0,2604.0,Sutter Coast Hospital,2019
701,30600035,HCHG NM GI BLEEDING SCAN,341.0,2687.0,2687.0,Sutter Coast Hospital,2019
702,30600036,HCHG NM BOWEL (MECKELS) SCAN,341.0,1648.0,1648.0,Sutter Coast Hospital,2019
703,30600038,HCHG NM BONE SCAN SINGLE AREA,341.0,1734.0,1734.0,Sutter Coast Hospital,2019
704,30600039,HCHG NM BONE SCAN MULTIPLE AREAS,341.0,2175.0,2175.0,Sutter Coast Hospital,2019
705,30600040,HCHG NM BONE SCAN WHOLE BODY,341.0,2858.0,2858.0,Sutter Coast Hospital,2019
706,30600041,HCHG NM BONE SCAN THREE PHASE,341.0,3251.0,3251.0,Sutter Coast Hospital,2019
707,30600042,HCHG NM BONE SCAN W SPECT,341.0,2630.0,2630.0,Sutter Coast Hospital,2019
708,30600047,HCHG NM MYOCARDIAL PERFUSION SINGLE ACQ,341.0,5466.0,5466.0,Sutter Coast Hospital,2019
709,30600049,HCHG NM MYOCARDIAL PERFUSION SPECT SINGLE ACQ,341.0,4777.0,4777.0,Sutter Coast Hospital,2019
710,30600050,HCHG NM MYOCARDIAL PERFUSION SPECT MULTI ACQ,341.0,5962.0,5962.0,Sutter Coast Hospital,2019
711,30600054,HCHG NM HEART GATED WALL MOTION (MUGA) SINGLE ACQ,341.0,2530.0,2530.0,Sutter Coast Hospital,2019
712,30600055,HCHG NM HEART GATED WALL MOTION (MUGA) MULTIPLE ACQ,341.0,2652.0,2652.0,Sutter Coast Hospital,2019
713,30600061,HCHG NM LUNG PERFUSION IMAGING,341.0,2369.0,2369.0,Sutter Coast Hospital,2019
714,30600077,HCHG NM RENAL SINGLE ACQ,341.0,2089.0,2089.0,Sutter Coast Hospital,2019
715,30600078,HCHG NM RENAL W FLOW,341.0,2150.0,2150.0,Sutter Coast Hospital,2019
716,30600079,HCHG NM RENOG SINGLE ACQ WO PHARM,341.0,2461.0,2461.0,Sutter Coast Hospital,2019
717,30600080,HCHG NM RENOG SINGLE ACQ W PHARM,341.0,2313.0,2313.0,Sutter Coast Hospital,2019
718,30600082,HCHG NM RENAL W SPECT,341.0,2051.0,2051.0,Sutter Coast Hospital,2019
719,30600083,HCHG NM RENAL FUNCTION NO SCAN (GFR),341.0,1189.0,1189.0,Sutter Coast Hospital,2019
720,30600086,HCHG NM TUMOR LOCALIZATION SINGLE ACQ,341.0,1852.0,1852.0,Sutter Coast Hospital,2019
721,30600089,HCHG NM TUMOR LOCALIZATION SPECT,341.0,2485.0,2485.0,Sutter Coast Hospital,2019
722,30600090,HCHG NM TUMOR LOCALIZATION WHOLE BODY 2 OR MORE DAYS,341.0,4030.0,4030.0,Sutter Coast Hospital,2019
723,30600091,HCHG NM ABSCESS LOCALIZATION SINGLE ACQ,341.0,2392.0,2392.0,Sutter Coast Hospital,2019
724,30600093,HCHG NM ABSCESS LOCALIZATION SPECT,341.0,3325.0,3325.0,Sutter Coast Hospital,2019
725,30600140,HCHG NM HEPATOBILIRY SYS IMAGE,341.0,2285.0,2285.0,Sutter Coast Hospital,2019
726,30600141,HCHG NM HEPATO SYS IMAG W/DRUG,341.0,2802.0,2802.0,Sutter Coast Hospital,2019
727,30600142,HCHG NM LUNG VENTILATION IMAGE,341.0,2895.0,2895.0,Sutter Coast Hospital,2019
728,30600143,HCHG NM LUNG VENT&PERFUS IMAGE,341.0,2705.0,2705.0,Sutter Coast Hospital,2019
729,30600144,HCHG NM LUNG PERFUSION DIFFERL,341.0,1735.0,1735.0,Sutter Coast Hospital,2019
730,30600158,HCHG NM THYROID UPTAKE MEASUREMENT,341.0,998.0,998.0,Sutter Coast Hospital,2019
731,30600159,HCHG NM THYROID IMAGING W/BLOOD FLOW,341.0,1096.0,1096.0,Sutter Coast Hospital,2019
732,30600160,HCHG NM THYROID IMAGING W/BLD FLOW UPTAKE MEASURE,341.0,1566.0,1566.0,Sutter Coast Hospital,2019
733,30600166,HCHG GASTRIC EMPTYING IMAGING STUDY,341.0,2700.0,2700.0,Sutter Coast Hospital,2019
734,30900103,HCHG CA CORONARY THROMBOLYSIS INTRAVENOUS INFUSION,480.0,1885.0,1885.0,Sutter Coast Hospital,2019
735,32000001,HCHG CA CARDIOVERSION ELECTRIC EXTERNAL,480.0,2208.0,2208.0,Sutter Coast Hospital,2019
736,32000003,HCHG EKG 12 LEAD TRACING ONLY,730.0,471.0,212.0,Sutter Coast Hospital,2019
737,32000006,HCHG CA CARDIAC STRESS TEST,482.0,1489.0,925.0,Sutter Coast Hospital,2019
738,32000008,HCHG EKG 1-3 LEAD TRACING ONLY,730.0,156.0,156.0,Sutter Coast Hospital,2019
739,32000009,HCHG EKG UP TO 48HRS WITH SCANNING RECORDING,731.0,545.0,545.0,Sutter Coast Hospital,2019
740,32000010,HCHG EKG UP TO 48 HRS WITH SCANNING ANALYSIS AND REPORT,731.0,689.0,689.0,Sutter Coast Hospital,2019
741,32000016,HCHG CA ECHO 2-D CONGENITAL ANOMALY COMPLETE,483.0,1119.0,1119.0,Sutter Coast Hospital,2019
742,32000017,HCHG CA ECHO 2-D CONGENITAL ANOMALY LIMITED,483.0,746.0,746.0,Sutter Coast Hospital,2019
743,32000018,HCHG CA ECHO 2-D COMPLETE,483.0,1907.0,1907.0,Sutter Coast Hospital,2019
744,32000019,HCHG CA ECHO 2-D LIMITED,483.0,1029.0,1029.0,Sutter Coast Hospital,2019
745,32000022,HCHG CA ECHO DOPPLER COMPLETE,483.0,876.0,565.0,Sutter Coast Hospital,2019
746,32000024,HCHG CA ECHO DOPPLER COLOR FLOW,483.0,891.0,342.0,Sutter Coast Hospital,2019
747,32000032,HCHG CA CPR,480.0,1388.0,1388.0,Sutter Coast Hospital,2019
748,32000045,HCHG CA ECHO 2D COM TRNS W/CON,483.0,1845.0,1845.0,Sutter Coast Hospital,2019
749,32000074,HCHG CA TTE W/DOPPLER COMPLETE,483.0,2793.0,2696.0,Sutter Coast Hospital,2019
750,33000000,HCHG VENT MANAGEMENT INITIAL HF,410.0,3724.0,3724.0,Sutter Coast Hospital,2019
751,33000001,HCHG VENT MANAGEMENT INITIAL TRAUMA,410.0,3724.0,3724.0,Sutter Coast Hospital,2019
752,33000002,HCHG VENT MANAGEMENT INITIAL ADULT,410.0,3724.0,3724.0,Sutter Coast Hospital,2019
753,33000003,HCHG VENT MANAGEMENT INITIAL NEO/PEDS,410.0,3724.0,3724.0,Sutter Coast Hospital,2019
754,33000004,HCHG VENT MANAGEMENT SUBSEQUENT HF,410.0,3096.0,3096.0,Sutter Coast Hospital,2019
755,33000005,HCHG VENT MANAGEMENT SUBSEQUENT NEO/PEDS,410.0,3096.0,3096.0,Sutter Coast Hospital,2019
756,33000006,HCHG VENT MANAGEMENT SUBSEQUENT TRAUMA,410.0,3096.0,3096.0,Sutter Coast Hospital,2019
757,33000007,HCHG VENT MANAGEMENT SUBSEQUENT ADULT,410.0,3096.0,3096.0,Sutter Coast Hospital,2019
758,33000008,HCHG IPPB TREATMENT SUBSEQUENT,412.0,418.0,418.0,Sutter Coast Hospital,2019
759,33000009,HCHG IPV TREATMENT SUBSEQUENT,412.0,418.0,418.0,Sutter Coast Hospital,2019
760,33000010,HCHG AIRWAY INHALATION TREATMENT,412.0,418.0,418.0,Sutter Coast Hospital,2019
761,33000011,HCHG CONTINUOUS BREATHING TREATMENT 1ST HOUR,410.0,443.0,443.0,Sutter Coast Hospital,2019
762,33000012,HCHG BIPAP/CPAP/SIPAP SUBSEQUENT DAY,410.0,1652.0,1652.0,Sutter Coast Hospital,2019
763,33000013,HCHG BIPAP/CPAP/SIPAP INITIAL DAY,410.0,1652.0,1652.0,Sutter Coast Hospital,2019
764,33000016,HCHG CHEST PHYSIOTHERAPY INITIAL,410.0,378.0,378.0,Sutter Coast Hospital,2019
765,33000017,HCHG CHEST PHYSIOTHERAPY SUBSEQUENT,410.0,276.0,276.0,Sutter Coast Hospital,2019
766,33000019,HCHG THERAPEUTIC PROCEDURE STRENGTH/ENDURANCE 15MIN,419.0,129.0,129.0,Sutter Coast Hospital,2019
767,33000020,HCHG THERAPEUTIC PROCEDURE RESPIRATORY FUNCTION 15MIN,419.0,133.0,133.0,Sutter Coast Hospital,2019
768,33000022,HCHG PENTAMIDINE NEBULIZATION TX,412.0,375.0,375.0,Sutter Coast Hospital,2019
769,33000023,HCHG AEROSOL TREATMENT DEMO/EVAL,412.0,350.0,350.0,Sutter Coast Hospital,2019
770,33000027,HCHG AEROSOL TREATMENT SUBSEQUENT,412.0,418.0,418.0,Sutter Coast Hospital,2019
771,33000028,HCHG CONTINUOUS BREATHING TREATMENT EACH ADDITIONAL HOUR,410.0,269.0,269.0,Sutter Coast Hospital,2019
772,33000029,HCHG SUCTION NASOTRACHEAL,410.0,287.0,287.0,Sutter Coast Hospital,2019
773,33000030,HCHG MDI/NEBULIZER TREATMENT SUBSEQUENT,412.0,418.0,418.0,Sutter Coast Hospital,2019
774,33000034,HCHG PLETHYSMOGRAPHY LUNG VOL,460.0,657.0,657.0,Sutter Coast Hospital,2019
775,33000035,HCHG PULM FUNCTION TEST BY GAS,460.0,457.0,457.0,Sutter Coast Hospital,2019
776,33000036,HCHG PULM FUNC BY OSCILLOMETRY,460.0,296.0,296.0,Sutter Coast Hospital,2019
777,33000046,HCHG PEP THERAPY,412.0,350.0,350.0,Sutter Coast Hospital,2019
778,33050000,HCHG SPIROMETRY,460.0,433.0,419.0,Sutter Coast Hospital,2019
779,33050001,HCHG SPIROMETRY PRE AND POST BRONCHODILATOR,460.0,973.0,973.0,Sutter Coast Hospital,2019
780,33050002,HCHG BRONCHIAL PROVOCATION,460.0,1241.0,1241.0,Sutter Coast Hospital,2019
781,33050003,HCHG VITAL CAPACITY,460.0,188.0,188.0,Sutter Coast Hospital,2019
782,33050004,HCHG MAXIMAL VOLUNTARY VENTILATION,460.0,286.0,286.0,Sutter Coast Hospital,2019
783,33050009,HCHG RESPIRATORY FLOW VOLUME LOOP,460.0,544.0,544.0,Sutter Coast Hospital,2019
784,33050015,HCHG OXYGEN UPTAKE STUDY SIMPLE,460.0,889.0,889.0,Sutter Coast Hospital,2019
785,33050018,HCHG CO DIFFUSING CAPACITY,460.0,516.0,516.0,Sutter Coast Hospital,2019
786,33050024,HCHG CO2 DETERMINATION/ETCO2 INITIAL,460.0,468.0,468.0,Sutter Coast Hospital,2019
787,33050025,HCHG C02 DETERMINATION/ETCO2 SUBSEQUENT,460.0,468.0,468.0,Sutter Coast Hospital,2019
788,33050026,HCHG TCM SUBSEQUENT DAY,460.0,241.0,241.0,Sutter Coast Hospital,2019
789,33050027,HCHG TCM INITIAL DAY,460.0,241.0,241.0,Sutter Coast Hospital,2019
790,33050034,HCHG SLEEP STUDY NEO/PEDS,460.0,2732.0,2732.0,Sutter Coast Hospital,2019
791,33050036,HCHG AEROSOL TX INITIAL,412.0,418.0,418.0,Sutter Coast Hospital,2019
792,33050037,HCHG IPPB TX INITIAL,412.0,418.0,418.0,Sutter Coast Hospital,2019
793,33050038,HCHG IPV INITIAL,412.0,418.0,418.0,Sutter Coast Hospital,2019
794,33050039,HCHG MDI/NEB INITIAL,412.0,418.0,418.0,Sutter Coast Hospital,2019
795,33050063,HCHG CO2 RESPONSE CURVE,460.0,1628.0,1628.0,Sutter Coast Hospital,2019
796,35000002,HCHG SLEEP STUDY UNATTENDED,740.0,1521.0,1521.0,Sutter Coast Hospital,2019
797,35000003,HCHG SLEEP STUDY ATTENDED > 6 HOURS,740.0,1619.0,1619.0,Sutter Coast Hospital,2019
798,35000009,HCHG EEG AWAKE AND ASLEEP RECORDS 20-40 MIN,740.0,1414.0,1414.0,Sutter Coast Hospital,2019
799,40800102,HCHG REF NEO BRAF MUTATION ANALYSIS BI DIRECTIONAL,310.0,170.0,170.0,Sutter Coast Hospital,2019
800,40800103,HCHG REF NEO EGFR MUTATION ANALYSIS BI-DIRECTIONAL,310.0,377.0,377.0,Sutter Coast Hospital,2019
801,40800104,HCHG REF NEO KRAS MUTATION ANALYSIS BY PCR,310.0,313.0,313.0,Sutter Coast Hospital,2019
802,40800170,HCHG REF NEO MGMT GENE METHYLATION ANAL,301.0,320.0,320.0,Sutter Coast Hospital,2019
803,40800259,HCHG REF NEO BRAF MUTATION ANALYSIS BY PCR,310.0,125.0,125.0,Sutter Coast Hospital,2019
804,40800260,HCHG REF NEO BRAF V600 MUTIONAL FDA APPROVED,310.0,808.0,808.0,Sutter Coast Hospital,2019
805,40800261,HCHG REF NEO EGFR MUTATION ANALYSIS BY PCR,310.0,377.0,377.0,Sutter Coast Hospital,2019
806,40800262,HCHG REF NEO EGFR FDA APPROVED KIT,310.0,1316.0,1316.0,Sutter Coast Hospital,2019
807,40900005,HCHG CORE CULT HSV,306.0,456.0,456.0,Sutter Coast Hospital,2019
808,40900009,HCHG CORE HISTONE AB,301.0,56.0,56.0,Sutter Coast Hospital,2019
809,40900010,HCHG CORE ALLERGEN SPECIFIC IGE QN/SEMI CRUDE EXT,302.0,70.0,45.0,Sutter Coast Hospital,2019
810,40900011,HCHG CORE ALPH 1 ANTITRYPSN,301.0,86.0,86.0,Sutter Coast Hospital,2019
811,40900012,HCHG CORE APOLIPOPROTEIN B,301.0,131.0,131.0,Sutter Coast Hospital,2019
812,40900013,HCHG CORE APOLIPOPROTEIN A1,301.0,131.0,131.0,Sutter Coast Hospital,2019
813,40900017,HCHG CORE PHENYTOIN FREE,301.0,282.0,282.0,Sutter Coast Hospital,2019
814,40900021,HCHG CORE ASSY TST BLD FCL,301.0,80.0,80.0,Sutter Coast Hospital,2019
815,40900022,HCHG CORE RUBEOLA AB IGG,302.0,60.0,60.0,Sutter Coast Hospital,2019
816,40900023,HCHG CORE RUBEOLA AB IGM,302.0,60.0,60.0,Sutter Coast Hospital,2019
817,40900024,HCHG CORE TB TST CELL IMM MS,302.0,303.0,303.0,Sutter Coast Hospital,2019
818,40900026,HCHG CORE PROTN ELECTRO UR,301.0,112.0,112.0,Sutter Coast Hospital,2019
819,40900027,HCHG CORE VZV AB IGG,302.0,74.0,58.0,Sutter Coast Hospital,2019
820,40900028,HCHG CORE VZV AB IGM,302.0,74.0,58.0,Sutter Coast Hospital,2019
821,40900031,HCHG CORE HEPARIN ASSAY,305.0,280.0,280.0,Sutter Coast Hospital,2019
822,40900032,HCHG CORE FCTR V,305.0,224.0,224.0,Sutter Coast Hospital,2019
823,40900033,HCHG CORE FCTR II,305.0,188.0,188.0,Sutter Coast Hospital,2019
824,40900034,HCHG CORE FCTR IX,305.0,299.0,299.0,Sutter Coast Hospital,2019
825,40900035,HCHG CORE FCTR VIII,305.0,129.0,129.0,Sutter Coast Hospital,2019
826,40900036,HCHG CORE FCTR VII,305.0,261.0,261.0,Sutter Coast Hospital,2019
827,40900037,HCHG CORE FCTR X,305.0,279.0,279.0,Sutter Coast Hospital,2019
828,40900038,HCHG CORE FCTR XI,305.0,217.0,217.0,Sutter Coast Hospital,2019
829,40900039,HCHG CORE FCTR XII,305.0,162.0,162.0,Sutter Coast Hospital,2019
830,40900040,HCHG CORE HIV 1 RNA QN PCR W/WO REVRS TRNSCRP,306.0,404.0,404.0,Sutter Coast Hospital,2019
831,40900041,HCHG CORE PROTEIN S ACTIVITY,305.0,112.0,112.0,Sutter Coast Hospital,2019
832,40900042,HCHG CORE VITAMIN D 25HYDROXY,301.0,187.0,187.0,Sutter Coast Hospital,2019
833,40900043,HCHG CORE PREALBUMIN,301.0,142.0,142.0,Sutter Coast Hospital,2019
834,40900044,HCHG CORE PROTEIN C ACTIVATED,305.0,210.0,210.0,Sutter Coast Hospital,2019
835,40900045,HCHG CORE CARDIOLIPIN IGA AB,302.0,27.0,27.0,Sutter Coast Hospital,2019
836,40900046,HCHG CORE CARDIOLIPIN IGG AB,302.0,27.0,27.0,Sutter Coast Hospital,2019
837,40900047,HCHG CORE CARDIOLIPIN IGM AB,302.0,27.0,27.0,Sutter Coast Hospital,2019
838,40900048,HCHG CORE C REACTIVE PROTEIN,302.0,132.0,89.0,Sutter Coast Hospital,2019
839,40900049,HCHG CORE DHEA SULFATE,301.0,100.0,83.0,Sutter Coast Hospital,2019
840,40900051,HCHG CORE BETA HCG QUAN,301.0,303.0,243.0,Sutter Coast Hospital,2019
841,40900052,HCHG CORE INSULIN,301.0,247.0,129.0,Sutter Coast Hospital,2019
842,40900053,HCHG CORE PROTEIN C ACTIVITY,305.0,143.0,143.0,Sutter Coast Hospital,2019
843,40900054,HCHG CORE PLSMG,305.0,42.0,42.0,Sutter Coast Hospital,2019
